Track ID,Track Name,Album Name,Artist Name(s),Release Date,Duration (ms),Popularity,Added By,Added At,Genre,Danceability,Energy,Key,Loudness,Mode,Speechiness,Acousticness,Instrumentalness,Liveness,Valence,Tempo,Time Signature,Playlist Name,Playlist URI
0jSvTm2d5guevlaLKSYA84,Gucci Slides (feat. LORYN),Gucci Slides,Boston Bun;LORYN,05/29/2020,177295,23,trey.mcmillon,2020-12-04T03:34:50Z,,0.655,0.718,11,-6.043,0,0.25,0.204,0,0.173,0.477,125.046,4,20,2mGMkrkQ9urAsJR0GqVQ62
0sci7ppTZFm4mjcH3nu8yO,nasty,Positions,Ariana Grande,10/30/2020,200732,67,trey.mcmillon,2020-11-30T18:55:05Z,pop,0.772,0.506,6,-6.558,0,0.139,0.0814,0.000011,0.182,0.456,127.894,4,20,2mGMkrkQ9urAsJR0GqVQ62
0smgkpVia3VCXgY4qhVJvp,Guilty Conscience,Modus Vivendi,070 Shake,01/17/2020,213333,56,trey.mcmillon,2020-12-08T14:04:26Z,,0.542,0.637,7,-6.049,1,0.135,0.00675,0,0.123,0.221,179.813,4,20,2mGMkrkQ9urAsJR0GqVQ62
0xD5Zn7YbueY9ukGJWlTXM,Call It What You Want,aiMless,rum.gold,04/24/2020,234905,26,trey.mcmillon,2020-12-15T13:32:45Z,alternative r&b,0.567,0.209,11,-14.595,0,0.0356,0.876,0.000951,0.0926,0.268,84.117,4,20,2mGMkrkQ9urAsJR0GqVQ62
15NQ3x1f2GUhqs8oBXhTqp,Scottie Beam,Alfredo,Freddie Gibbs;The Alchemist;Rick Ross,05/29/2020,244053,62,trey.mcmillon,2020-12-10T15:53:46Z,"jazz rap,alternative hip hop,experimental hip hop,boom bap,southern hip hop",0.523,0.654,6,-9.531,0,0.216,0.815,0.00000834,0.211,0.544,79.192,4,20,2mGMkrkQ9urAsJR0GqVQ62
19CSr8rwW05VJL2F91KFNK,ivy,evermore,Taylor Swift,12/11/2020,260440,64,trey.mcmillon,2020-12-11T15:39:42Z,,0.515,0.545,2,-9.277,1,0.0353,0.855,0.0000197,0.0921,0.535,88.856,4,20,2mGMkrkQ9urAsJR0GqVQ62
1W1pokpC4XLVjVMXUCWi5l,Can't Go For That (feat. Lil Duval),So Help Me God!,2 Chainz;Ty Dolla $ign;Lil Duval,11/13/2020,179130,42,trey.mcmillon,2020-11-20T00:25:09Z,"rap,southern hip hop,trap soul",0.795,0.665,2,-7.091,1,0.0625,0.0119,0,0.106,0.335,98.542,4,20,2mGMkrkQ9urAsJR0GqVQ62
2alJKJoqOOEPVU1Do3eIjJ,53.49,3.15.20,Childish Gambino,03/22/2020,235280,0,trey.mcmillon,2020-12-01T22:00:01Z,,0.518,0.952,6,-5.274,0,0.198,0.0287,0,0.381,0.622,171.905,4,20,2mGMkrkQ9urAsJR0GqVQ62
2ENxOXbxhfJ3lfItO0MFDv,Take Care of You (feat. Syd),Take Care of You / Summertime,Charlotte Day Wilson;Syd,08/13/2020,214437,40,trey.mcmillon,2020-12-02T16:03:34Z,alternative r&b,0.666,0.535,4,-9.033,0,0.112,0.827,0.0228,0.202,0.259,127.029,4,20,2mGMkrkQ9urAsJR0GqVQ62
2IDUt4NBzRoF7EWXEMYhGa,DEALER,DRUG DEALING IS A LOST ART,RMR,06/12/2020,144723,23,trey.mcmillon,2020-12-01T22:11:42Z,,0.856,0.566,1,-4.874,1,0.0505,0.15,0.000176,0.131,0.0439,120.028,4,20,2mGMkrkQ9urAsJR0GqVQ62
2leLCJ5Gjm9gAgPbcz2frL,church,church / boston,boylife,07/16/2020,155434,25,trey.mcmillon,2020-11-20T18:43:54Z,bedroom pop,0.373,0.658,6,-5.289,1,0.164,0.101,0.000175,0.28,0.273,120.557,3,20,2mGMkrkQ9urAsJR0GqVQ62
2q3VZjLVCWbJq0rICML7va,Woo!,I'm Allergic To Dogs!,Remi Wolf,06/24/2020,196562,47,trey.mcmillon,2020-12-08T14:04:51Z,,0.784,0.462,0,-5.091,0,0.0548,0.207,0.00000345,0.106,0.744,86.004,4,20,2mGMkrkQ9urAsJR0GqVQ62
2SAqBLGA283SUiwJ3xOUVI,Laugh Now Cry Later (feat. Lil Durk),Laugh Now Cry Later (feat. Lil Durk),Drake;Lil Durk,08/14/2020,261492,75,trey.mcmillon,2020-12-08T15:20:22Z,"rap,chicago drill,drill",0.761,0.518,0,-8.871,1,0.134,0.244,0.0000347,0.107,0.522,133.976,4,20,2mGMkrkQ9urAsJR0GqVQ62
3hARuUtzTdUuWH1KiLJlSf,Window,Window,Still Woozy,04/17/2020,139293,53,trey.mcmillon,2020-11-30T18:54:53Z,bedroom pop,0.714,0.483,4,-9.378,0,0.195,0.436,0.000023,0.28,0.67,91.025,4,20,2mGMkrkQ9urAsJR0GqVQ62
4EcoXZhvbU3qS7ORWUEcVI,Take Me Where Your Heart Is,The Shave Experiment,Q,12/11/2020,192896,68,trey.mcmillon,2020-11-09T15:30:10Z,"alternative r&b,chill r&b,indie r&b",0.858,0.426,10,-8.879,0,0.0402,0.00586,0.761,0.0977,0.419,89.981,4,20,2mGMkrkQ9urAsJR0GqVQ62
4Rq2BMG5VWMhb2whSx8bf4,Tommy Lee (feat. SAINt JHN & Post Malone) - Remix,Tommy Lee (feat. SAINt JHN & Post Malone) [Remix],Tyla Yaweh;SAINt JHN;Post Malone,08/28/2020,230488,44,trey.mcmillon,2020-11-09T15:29:44Z,melodic rap,0.504,0.597,10,-6.237,1,0.1,0.206,0,0.0949,0.557,117.974,4,20,2mGMkrkQ9urAsJR0GqVQ62
4VwAIIQDPR3T7EPnzk7Fv1,Take Me to the Good Times,Take Me to the Good Times,The Suffers,06/24/2020,264747,0,trey.mcmillon,2020-11-30T18:53:09Z,"retro soul,retro pop,funk",0.667,0.837,0,-4.589,0,0.119,0.119,0.00000101,0.194,0.821,94.982,4,20,2mGMkrkQ9urAsJR0GqVQ62
4wVOKKEHUJxHCFFNUWDn0B,Chicago Freestyle (feat. Giveon),Dark Lane Demo Tapes,Drake;GIVĒON,05/01/2020,220487,78,trey.mcmillon,2020-11-14T20:12:27Z,"rap,r&b",0.735,0.449,10,-7.507,1,0.347,0.629,0,0.113,0.0397,122.947,4,20,2mGMkrkQ9urAsJR0GqVQ62
5RqR4ZCCKJDcBLIn4sih9l,Party Girl,Party Girl,StaySolidRocky,04/21/2020,147800,68,trey.mcmillon,2020-11-18T15:12:00Z,,0.728,0.431,6,-9.966,0,0.0622,0.749,0,0.0996,0.629,130.022,4,20,2mGMkrkQ9urAsJR0GqVQ62
5UusfWUMMLEXLMc1ViNZoe,@ MEH,@ MEH,Playboi Carti,04/16/2020,166799,57,trey.mcmillon,2020-12-01T21:57:15Z,rage rap,0.876,0.492,11,-8.11,0,0.153,0.0136,0.000283,0.0678,0.4,151.044,4,20,2mGMkrkQ9urAsJR0GqVQ62
5y79D5wSVrcB5eFq0gaWfL,I Know Alone,Women In Music Pt. III,HAIM,06/26/2020,226026,0,trey.mcmillon,2020-12-15T13:19:19Z,,0.772,0.658,0,-6.93,1,0.0722,0.14,0.0111,0.117,0.355,128.078,4,20,2mGMkrkQ9urAsJR0GqVQ62
60v8m0VhlTqw7GgIQDxNbq,Are You Feeling Sad?,"New Me, Same Us",Little Dragon;Kali Uchis,03/27/2020,158015,42,trey.mcmillon,2020-12-02T18:21:22Z,trip hop,0.767,0.646,5,-8.612,0,0.0424,0.0616,0.0000581,0.333,0.462,113.006,4,20,2mGMkrkQ9urAsJR0GqVQ62
6tfrMstZ8tw7nZJ6HP0PyW,holy calamafuck,RTJ4,Run The Jewels;El-P;Killer Mike,06/03/2020,238413,0,trey.mcmillon,2020-12-01T22:00:18Z,"hip hop,experimental hip hop,southern hip hop,alternative hip hop",0.603,0.764,7,-7.407,1,0.287,0.0557,0,0.621,0.382,119.942,4,20,2mGMkrkQ9urAsJR0GqVQ62
6YheRoPUnQc0mXiWBUiQz5,Cut Me,græ,Moses Sumney,05/15/2020,250120,0,trey.mcmillon,2020-12-01T22:04:12Z,"art pop,indie soul",0.509,0.304,6,-11.139,1,0.035,0.879,0.00336,0.102,0.355,165.832,4,20,2mGMkrkQ9urAsJR0GqVQ62
72Jj7fnjwDLloza2IJyIWL,What Typa Time,In Between Spaces,Woodie Smalls;Isaiah Rashad,06/19/2020,237999,0,trey.mcmillon,2020-11-09T15:28:15Z,,0.839,0.467,2,-10.686,1,0.332,0.224,0,0.0924,0.644,120.992,4,20,2mGMkrkQ9urAsJR0GqVQ62
73cDYVsTyf8ZDbmO1SkYix,Miss Me? - Chopnotslop Remix,A Muse In Her Feelings (Chopnotslop Remix),dvsn;DJ Candlestick;OG Ron C,07/10/2020,380638,0,trey.mcmillon,2020-12-15T13:31:59Z,"trap soul,alternative r&b",0.941,0.332,1,-12.642,1,0.103,0.158,0.000505,0.112,0.442,128.65,4,20,2mGMkrkQ9urAsJR0GqVQ62
778JDHI6qfgQ1HBEKP1FZu,Daydream,Daydream,The Aces,03/04/2020,150792,0,trey.mcmillon,2020-12-01T22:09:20Z,,0.697,0.798,4,-5.541,1,0.0581,0.0896,0,0.384,0.818,107.025,4,20,2mGMkrkQ9urAsJR0GqVQ62
7f2voPcnDEAzX4yB8SLnU2,Lord I Know,Man On The Moon III: The Chosen,Kid Cudi,12/11/2020,212040,44,trey.mcmillon,2020-12-11T14:16:53Z,,0.613,0.572,0,-9.6,1,0.157,0.583,0.295,0.102,0.0389,180.061,4,20,2mGMkrkQ9urAsJR0GqVQ62
7sjFIZ1g5QLJLGja3k592K,44 BullDog,Shoot For The Stars Aim For The Moon,Pop Smoke,07/03/2020,150857,55,trey.mcmillon,2020-12-04T03:10:58Z,"brooklyn drill,new york drill,drill",0.8,0.564,8,-5.817,1,0.4,0.0287,0.00000165,0.112,0.318,139.989,4,20,2mGMkrkQ9urAsJR0GqVQ62
7sOfmPd18RWp3FoCzpa7Kw,Soliá,YHLQMDLG,Bad Bunny,02/29/2020,159282,71,trey.mcmillon,2020-12-01T19:39:04Z,"reggaeton,trap latino,urbano latino,latin",0.71,0.81,2,-5.507,1,0.0854,0.117,0.000132,0.154,0.184,92.041,4,20,2mGMkrkQ9urAsJR0GqVQ62
0Jlcvv8IykzHaSmj49uNW8,the 1,folklore,Taylor Swift,07/24/2020,210251,77,molly.verrone,2020-12-08T16:10:33Z,,0.777,0.357,0,-6.942,1,0.0522,0.757,0.00000728,0.108,0.172,139.884,4,2020,0Yd0lbyeczsCeVJACt0BAn
0lx2cLdOt3piJbcaXIV74f,willow,evermore,Taylor Swift,12/11/2020,214706,73,molly.verrone,2020-12-14T15:25:36Z,pop,0.392,0.574,7,-9.195,1,0.17,0.833,0.00179,0.145,0.529,81.112,4,2020,0Yd0lbyeczsCeVJACt0BAn
0tbjiOUl4k492KPdWZS9sy,7 Summers,7 Summers,Morgan Wallen,08/14/2020,210122,19,molly.verrone,2020-12-08T16:23:44Z,country,0.457,0.774,0,-5.201,1,0.0336,0.428,0.0000429,0.119,0.59,203.863,4,2020,0Yd0lbyeczsCeVJACt0BAn
1Ia95g66IhlAJ3qVI4qI8W,Slow,Slow,shy martin,01/10/2020,163547,10,molly.verrone,2020-12-08T16:12:26Z,,0.636,0.243,2,-9.509,1,0.04,0.815,0,0.111,0.239,142.016,4,2020,0Yd0lbyeczsCeVJACt0BAn
1mMvahhW2Oz9waG8UTQnI4,Never Felt A Love Like This (with Hook N Sling) [feat. Dotan],Church,Galantis;Hook N Sling;Dotan,02/07/2020,215388,44,molly.verrone,2020-12-08T16:13:28Z,folk pop,0.58,0.804,9,-4.618,1,0.0279,0.0304,0.00359,0.105,0.137,126.005,4,2020,0Yd0lbyeczsCeVJACt0BAn
1n4vgMWmmNlXrvyxQFhUEl,If You’re Too Shy (Let Me Know),If You’re Too Shy (Let Me Know),The 1975,04/23/2020,319370,43,molly.verrone,2020-12-08T16:23:27Z,,0.639,0.63,2,-6.1,1,0.0325,0.0151,0.0374,0.0959,0.218,125.648,4,2020,0Yd0lbyeczsCeVJACt0BAn
1XjHRolIXL2M1EEOUsGGR4,cowboy like me,evermore,Taylor Swift,12/11/2020,275040,65,molly.verrone,2020-12-14T15:25:51Z,,0.604,0.517,0,-9.014,1,0.0347,0.768,0.000155,0.123,0.511,127.967,4,2020,0Yd0lbyeczsCeVJACt0BAn
2Eeur20xVqfUoM3Q7EFPFt,the last great american dynasty,folklore,Taylor Swift,07/24/2020,230999,69,molly.verrone,2020-12-08T16:11:25Z,,0.686,0.662,7,-8.505,1,0.0413,0.467,0.0023,0.109,0.706,147.922,4,2020,0Yd0lbyeczsCeVJACt0BAn
2GjQ5KNXggsIRpx5ZUj2zX,Her,Her,Anne-Marie,03/22/2020,177568,55,molly.verrone,2020-12-08T16:15:34Z,,0.563,0.395,10,-5.568,1,0.0302,0.873,0,0.106,0.327,120.134,4,2020,0Yd0lbyeczsCeVJACt0BAn
2kJwzbxV2ppxnQoYw4GLBZ,If the World Was Ending (feat. Julia Michaels),If the World Was Ending (feat. Julia Michaels),JP Saxe;Julia Michaels,10/17/2019,208687,73,molly.verrone,2020-12-08T16:11:52Z,,0.464,0.473,1,-10.086,1,0.129,0.866,0,0.109,0.604,75.801,4,2020,0Yd0lbyeczsCeVJACt0BAn
2mE9iW3E4iteXrrWneOYsT,Do It,Ungodly Hour,Chloe x Halle,06/12/2020,176786,40,molly.verrone,2020-12-08T16:41:21Z,r&b,0.701,0.668,5,-7.287,0,0.0516,0.0916,0.00000209,0.111,0.553,82.978,4,2020,0Yd0lbyeczsCeVJACt0BAn
2N2niBI0xAbLl3jI6l4S7g,The Steps,Women In Music Pt. III,HAIM,06/26/2020,247600,0,molly.verrone,2020-12-08T16:33:32Z,,0.703,0.714,2,-4.967,1,0.0316,0.0197,0.00000165,0.0849,0.62,116.723,4,2020,0Yd0lbyeczsCeVJACt0BAn
2Oycxb8QbPkpHTo8ZrmG0B,Prisoner (feat. Dua Lipa),Plastic Hearts,Miley Cyrus;Dua Lipa,11/27/2020,169333,70,molly.verrone,2020-12-08T16:18:00Z,pop,0.781,0.67,3,-3.912,0,0.0452,0.0103,0,0.0761,0.595,127.99,4,2020,0Yd0lbyeczsCeVJACt0BAn
3QKcv32c31JrHs1YqtnqRB,The Wire,The Wire,Patrick Droney,02/21/2020,212268,28,molly.verrone,2020-12-08T15:38:34Z,,0.509,0.881,2,-3.169,1,0.0498,0.00525,0.00281,0.0729,0.268,94.983,4,2020,0Yd0lbyeczsCeVJACt0BAn
3RaT22zZsxVYxxKR7TAaYF,"no body, no crime (feat. HAIM)",evermore,Taylor Swift;HAIM,12/11/2020,215626,63,molly.verrone,2020-12-14T15:25:43Z,"pop,art pop,dance pop,indie pop,metropopolis,pop rock",0.546,0.613,7,-7.589,0,0.0264,0.418,0,0.103,0.535,79.015,4,2020,0Yd0lbyeczsCeVJACt0BAn
4HBZA5flZLE435QTztThqH,Stuck with U (with Justin Bieber),Stuck with U,Ariana Grande;Justin Bieber,05/08/2020,228482,80,molly.verrone,2020-12-08T16:09:19Z,pop,0.597,0.45,8,-6.658,1,0.0418,0.223,0,0.382,0.537,178.765,3,2020,0Yd0lbyeczsCeVJACt0BAn
4Oun2ylbjFKMPTiaSbbCih,WAP (feat. Megan Thee Stallion),WAP (feat. Megan Thee Stallion),Cardi B;Megan Thee Stallion,08/07/2020,187541,74,molly.verrone,2020-12-08T16:19:12Z,,0.935,0.454,1,-7.509,1,0.375,0.0194,0,0.0824,0.357,133.073,4,2020,0Yd0lbyeczsCeVJACt0BAn
4pvb0WLRcMtbPGmtejJJ6y,exile (feat. Bon Iver),folklore,Taylor Swift;Bon Iver,07/24/2020,285634,80,molly.verrone,2020-12-08T16:10:40Z,,0.298,0.38,6,-8.426,1,0.0287,0.778,0.0000562,0.11,0.152,75.602,4,2020,0Yd0lbyeczsCeVJACt0BAn
4UN6sBmFTt2IqxN3IRqJT3,Gaslighter,Gaslighter,The Chicks,07/17/2020,203466,49,molly.verrone,2020-12-08T16:26:51Z,country,0.681,0.728,2,-7.317,1,0.0513,0.00624,0,0.055,0.693,131.017,4,2020,0Yd0lbyeczsCeVJACt0BAn
5GK1GYXH16RdfmltogHhAk,Heart Of Glass (Live from the iHeart Festival),Plastic Hearts,Miley Cyrus,11/27/2020,213671,65,molly.verrone,2020-12-08T16:18:34Z,,0.58,0.908,4,-5.303,1,0.0341,0.000335,0.0000484,0.087,0.427,115.016,4,2020,0Yd0lbyeczsCeVJACt0BAn
5NUXE8W12lWcUXgJRCjeEw,One Too Many,One Too Many,Keith Urban;P!nk,09/16/2020,203893,59,molly.verrone,2020-12-08T17:15:47Z,country,0.697,0.535,4,-6.504,1,0.068,0.247,0,0.569,0.594,82.959,4,2020,0Yd0lbyeczsCeVJACt0BAn
5u1n1kITHCxxp8twBcZxWy,Holy (feat. Chance The Rapper),Holy,Justin Bieber;Chance the Rapper,09/18/2020,212093,66,molly.verrone,2020-12-08T16:17:43Z,,0.673,0.704,6,-8.056,1,0.36,0.196,0,0.0898,0.372,86.919,4,2020,0Yd0lbyeczsCeVJACt0BAn
5v4GgrXPMghOnBBLmveLac,Savage Remix (feat. Beyoncé),Savage Remix (feat. Beyoncé),Megan Thee Stallion;Beyoncé,04/29/2020,242000,59,molly.verrone,2020-12-08T16:20:17Z,,0.822,0.743,10,-4.772,0,0.28,0.016,0,0.127,0.636,84.459,4,2020,0Yd0lbyeczsCeVJACt0BAn
6Im9k8u9iIzKMrmV7BWtlF,34+35,Positions,Ariana Grande,10/30/2020,173710,76,molly.verrone,2020-12-14T15:26:54Z,pop,0.83,0.585,0,-6.476,1,0.094,0.237,0,0.248,0.485,109.978,4,2020,0Yd0lbyeczsCeVJACt0BAn
6lQCFhlbA7boPBesUokiDU,I Got So High That I Saw Jesus (feat. Miley Cyrus) - Live Recording,I Got So High That I Saw Jesus (feat. Miley Cyrus) [Live Recording],Noah Cyrus;Miley Cyrus,10/26/2020,213095,45,molly.verrone,2020-12-08T16:18:45Z,,0.544,0.376,9,-6.734,1,0.0306,0.81,0,0.327,0.336,139.72,4,2020,0Yd0lbyeczsCeVJACt0BAn
6Q3K9gVUZRMZqZKrXovbM2,I'll Wait,I'll Wait,Kygo;Sasha Alex Sloan,04/03/2020,215360,57,molly.verrone,2020-12-08T16:11:02Z,tropical house,0.611,0.651,1,-6.973,1,0.0589,0.144,0.000017,0.105,0.351,122.983,4,2020,0Yd0lbyeczsCeVJACt0BAn
6tUI3ts8MMiMaGRHspW8Qx,With a Little Help from My Friends - Live From London,Delta Tour EP,Mumford & Sons,11/20/2020,359691,0,molly.verrone,2020-12-08T16:22:06Z,"folk,indie folk,folk rock",0.23,0.859,2,-5.315,1,0.0893,0.00365,0.000143,0.977,0.32,142.659,3,2020,0Yd0lbyeczsCeVJACt0BAn
7kDUspsoYfLkWnZR7qwHZl,my ex's best friend (with blackbear),Tickets To My Downfall,mgk;blackbear,09/25/2020,139460,73,molly.verrone,2020-12-14T15:25:15Z,,0.731,0.675,5,-5.134,0,0.0434,0.00473,0,0.141,0.298,124.939,4,2020,0Yd0lbyeczsCeVJACt0BAn
7pbxFCIMIYrfKsgpoB3UL6,Casino,Dreaming of David,Ryan Beatty,01/31/2020,259905,32,molly.verrone,2020-01-17T20:41:23Z,,0.6,0.322,0,-6.982,1,0.0315,0.472,0,0.14,0.219,109.877,4,2020,0Yd0lbyeczsCeVJACt0BAn
7zHDu3EKh7E9ljaPIFrzgv,But I Like It,Midwest Kids Can Make It Big,Lauren Sanderson,01/13/2020,149692,39,molly.verrone,2020-01-17T20:30:19Z,,0.731,0.362,2,-9.341,1,0.119,0.293,0,0.11,0.652,92.935,4,2020,0Yd0lbyeczsCeVJACt0BAn
08hB2ERJV6A1Ntu3OHgzjh,FMRN,FMRN,Lilyisthatyou,07/02/2021,122655,50,trey.mcmillon,2021-11-22T21:35:05Z,,0.735,0.586,8,-7.777,1,0.13,0.382,0,0.101,0.83,89.951,4,2021,41UsNnbA7eDB3yVhEBu4ul
0KbMjhlUH1xUGDgeIQzLsn,Duo,Duo,Sam Gellaitry,04/15/2021,126700,56,trey.mcmillon,2021-12-12T02:11:57Z,"electronic trap,future bass,scottish electronic,vapor twitch",0.805,0.7,10,-3.064,0,0.155,0.0547,0,0.04,0.832,127.034,4,2021,41UsNnbA7eDB3yVhEBu4ul
0lx2cLdOt3piJbcaXIV74f,willow,evermore,Taylor Swift,12/11/2020,214706,73,molly.verrone,2021-12-16T14:56:35Z,pop,0.392,0.574,7,-9.195,1,0.17,0.833,0.00179,0.145,0.529,81.112,4,2021,4QyoBbMlYdgUA64lRHzQRj
0mA7zotmg2ZFMRALljdZsS,Cloudy Day,Cloudy Day,Tones And I,06/10/2021,185303,71,molly.verrone,2021-06-14T16:41:29Z,"australian pop,pop",0.705,0.776,4,-6.096,1,0.0445,0.0643,0.00000281,0.0246,0.366,116.011,4,2021,4QyoBbMlYdgUA64lRHzQRj
0PDQRG9ogXCApqBNF6TmOb,...And Loyalty Is A Nuisance Child,The Asymptotical World EP,Yves Tumor,07/15/2021,133706,42,frank.gibase,2021-07-22T18:52:15Z,"art pop,escape room,experimental r&b",0.343,0.682,5,-5.03,0,0.0449,0.0000136,0.000126,0.144,0.292,129.178,4,2021,5NTX91pTinSo9FZyW8WStG
0qB5ojhJiQwQYokW3WTmKe,Locust Laced,Locust Laced,Sleigh Bells,07/28/2021,150946,40,frank.gibase,2021-08-06T02:47:41Z,"alternative dance,art pop,brooklyn indie,chillwave,electropop,escape room,experimental pop,indie pop,indie rock,indie surf,indietronica,modern rock,new rave,noise pop",0.477,0.757,1,-5.859,0,0.0751,0.0021,0.00000315,0.427,0.665,174.063,4,2021,5NTX91pTinSo9FZyW8WStG
18kMrxuEwLL0i4lHnlF5rK,Fast Car,Fast Car,Syd,07/16/2021,210000,56,trey.mcmillon,2021-12-06T19:24:42Z,"alternative r&b,chill r&b,escape room,indie r&b,indie soul,lgbtq+ hip hop,r&b",0.822,0.48,11,-7.175,0,0.0475,0.069,0.00486,0.322,0.577,111.959,4,2021,41UsNnbA7eDB3yVhEBu4ul
18XlJEroUwFo0tLZxscgXE,Lost,JORDI (Deluxe),Maroon 5,06/11/2021,172597,79,molly.verrone,2021-06-14T16:27:59Z,"pop,pop rock",0.766,0.706,7,-6.553,0,0.16,0.223,0.00028,0.064,0.766,142.989,4,2021,4QyoBbMlYdgUA64lRHzQRj
19HrcEC43P1y87E7kJZogL,dancing in the kitchen,gg bb xx (deluxe),LANY,11/05/2021,208808,53,molly.verrone,2021-12-16T15:09:01Z,"la pop,pop",0.646,0.736,11,-7.658,1,0.0396,0.0334,0,0.0807,0.28,94.024,4,2021,4QyoBbMlYdgUA64lRHzQRj
1EHUQesfVKwbthtNcpBi9g,WITHOUT YOU (with Miley Cyrus),WITHOUT YOU (with Miley Cyrus),"The Kid LAROI,Miley Cyrus",04/30/2021,161384,80,molly.verrone,2021-12-16T14:50:52Z,"australian hip hop,dance pop,pop,post-teen pop",0.655,0.469,0,-6.257,1,0.0292,0.173,0,0.0956,0.467,92.56,4,2021,4QyoBbMlYdgUA64lRHzQRj
1erZEUKhZ03cHHD0vOr8aQ,So I Lie,Art Dealer Chic 4,Miguel,04/09/2021,237240,46,trey.mcmillon,2021-12-01T23:58:43Z,"dance pop,pop,r&b,urban contemporary",0.689,0.707,11,-8.815,0,0.219,0.147,0.0774,0.116,0.624,109.945,4,2021,41UsNnbA7eDB3yVhEBu4ul
1fzf9Aad4y1RWrmwosAK5y,Last Train Home,Last Train Home,John Mayer,06/04/2021,187309,32,molly.verrone,2021-06-04T16:14:40Z,"neo mellow,pop rock,singer-songwriter",0.588,0.85,4,-6.431,1,0.0318,0.168,0.00202,0.0465,0.768,93.003,4,2021,4QyoBbMlYdgUA64lRHzQRj
1guCON9841cQwAlbNplLsY,Nothing Else Matters,Nothing Else Matters,Phoebe Bridgers,08/11/2021,274506,53,frank.gibase,2021-08-18T17:45:47Z,"indie pop,la indie",0.302,0.313,11,-14.266,0,0.0346,0.879,0.00579,0.111,0.512,152.25,3,2021,5NTX91pTinSo9FZyW8WStG
1P9VGEZN9L7YbIlsENOtJW,smoke break//,SURVIVORS GUILT: THE MIXTAPE//,"KennyHoopla,Travis Barker",06/11/2021,182866,56,molly.verrone,2021-06-14T16:44:22Z,"modern rock,pop punk,rap rock",0.402,0.823,2,-3.994,1,0.134,0.000956,0,0.343,0.314,170.192,4,2021,4QyoBbMlYdgUA64lRHzQRj
1PZDyestTVydtHpaIcfUJg,Chemtrails Over The Country Club,Chemtrails Over The Country Club,Lana Del Rey,01/11/2021,271176,6,frank.gibase,2021-01-12T18:21:16Z,"art pop,pop",0.334,0.276,4,-13.125,0,0.0643,0.877,0.000249,0.113,0.429,201.025,3,2021,5NTX91pTinSo9FZyW8WStG
1qYnqHydtG4iV9YenAz8Ux,Sunset,Dancing With The Devil…The Art of Starting Over (Deluxe Edition),Demi Lovato,04/05/2021,244481,50,molly.verrone,2021-04-10T14:51:10Z,"dance pop,pop,post-teen pop",0.629,0.566,5,-6.061,1,0.035,0.0421,0,0.337,0.476,77.653,3,2021,4QyoBbMlYdgUA64lRHzQRj
1xMvdOFQaql3EBkHmuh2TK,Batman,Batman,LPB Poody,02/12/2021,156431,70,trey.mcmillon,2021-12-02T00:03:24Z,florida rap,0.893,0.565,1,-4.74,1,0.268,0.0754,0,0.0375,0.808,81.009,4,2021,41UsNnbA7eDB3yVhEBu4ul
1yGiZ1DTPQAV9Ce4CdXUes,The Nowhere Inn,The Nowhere Inn,St. Vincent,09/14/2021,269374,44,frank.gibase,2021-09-14T19:38:59Z,"art pop,electropop,etherpop,indie pop,metropopolis",0.204,0.691,7,-8.385,1,0.0872,0.325,0.00605,0.324,0.423,75.187,5,2021,5NTX91pTinSo9FZyW8WStG
1ZeDNZoKgEOTRmTTg1zQd4,Parallel 4,Parallel,Four Tet,12/25/2020,287912,46,frank.gibase,2021-01-13T14:58:44Z,"alternative dance,electronica,folktronica,indie soul,intelligent dance music,new rave",0.735,0.668,1,-10.52,1,0.0514,0.0227,0.668,0.0647,0.517,125.747,4,2021,5NTX91pTinSo9FZyW8WStG
1ZIKpMTRPqhwAoVXWY3tXI,Chasing After You (with Maren Morris),Chasing After You (with Maren Morris),"Ryan Hurd,Maren Morris",02/12/2021,207973,77,molly.verrone,2021-09-13T17:59:40Z,"contemporary country,country pop,country,texas country",0.596,0.679,4,-6.395,1,0.0394,0.723,0,0.116,0.479,131.912,4,2021,4QyoBbMlYdgUA64lRHzQRj
2c4unmIQAceI4xjFum2mxH,Boys at School,The Turning Wheel,Spellling,06/25/2021,448653,14,frank.gibase,2021-08-19T14:53:54Z,"art pop,escape room,oakland indie",0.545,0.377,9,-12.533,0,0.0272,0.137,0.286,0.221,0.0788,112.047,4,2021,5NTX91pTinSo9FZyW8WStG
2etHQJxIbV0soyPhelVs9Y,Best Friend (feat. Doja Cat),Best Friend (feat. Doja Cat),"Saweetie,Doja Cat",01/07/2021,155883,82,molly.verrone,2021-06-04T16:15:31Z,"cali rap,dance pop,pop,pop rap,r&b,trap queen",0.84,0.766,4,-4.12,1,0.136,0.00302,0.00000361,0.0684,0.402,94.018,4,2021,4QyoBbMlYdgUA64lRHzQRj
2g3n5HwhJ5VukAfQaCmW5T,COLUMBIA,Fuck Your Expectations PT. 1,AG Club,04/02/2021,187896,48,trey.mcmillon,2021-12-10T21:21:39Z,"indie hip hop,underground hip hop",0.702,0.697,10,-5.465,0,0.109,0.0144,0,0.119,0.253,113.588,4,2021,41UsNnbA7eDB3yVhEBu4ul
2gG6IqL2enOyLdluSTcTTS,We Made It,We Made It,H.E.R.,06/11/2021,314848,56,molly.verrone,2021-06-14T16:36:35Z,"alternative r&b,dance pop,pop,r&b",0.552,0.745,2,-4.798,1,0.0448,0.0771,0.000141,0.175,0.153,116.092,4,2021,4QyoBbMlYdgUA64lRHzQRj
2ixabSVbccs9np9r5CpbWW,Don't Judge Me,Don't Judge Me,"FKA twigs,Headie One,Fred again..",01/26/2021,213679,52,frank.gibase,2021-02-03T14:41:29Z,"afrofuturism,alternative r&b,art pop,dance pop,escape room,experimental r&b,pop,trip hop,uk hip hop",0.61,0.625,9,-8.393,0,0.38,0.454,0.0043,0.109,0.236,96.063,4,2021,5NTX91pTinSo9FZyW8WStG
2Ms8MDDtYBw7M3K5F3EqPX,Dumb Love,Dumb Love,Mimi Webb,06/11/2021,207068,76,molly.verrone,2021-06-14T16:37:21Z,"alt z,dance pop,gen z singer-songwriter,pop,uk pop",0.569,0.422,0,-5.856,1,0.0302,0.0296,0,0.0613,0.175,76.96,4,2021,4QyoBbMlYdgUA64lRHzQRj
2pSsHnjAgEPjHmet7ChlHQ,Coming Back (feat. SZA),Friends That Break Your Heart,"James Blake,SZA",10/08/2021,195905,71,trey.mcmillon,2021-11-22T21:35:30Z,"alternative r&b,art pop,indie r&b,indie soul,uk alternative pop,pop,r&b,rap",0.653,0.496,10,-7.262,0,0.0868,0.625,0.274,0.151,0.102,86.013,4,2021,41UsNnbA7eDB3yVhEBu4ul
2stbjvpFujerfDUuUUPX7o,breadwinner,star-crossed,Kacey Musgraves,09/10/2021,200840,74,frank.gibase,2021-12-15T01:19:24Z,"contemporary country,country dawn,pop,texas country",0.866,0.508,8,-8.591,0,0.058,0.769,0.00000835,0.11,0.476,117.951,4,2021,5NTX91pTinSo9FZyW8WStG
2vSq4chJ1DUBjHDrU024AO,Shade of Yellow,One Foot In Front Of The Other,Griff,06/18/2021,156963,56,molly.verrone,2021-12-16T14:52:00Z,"alt z,dance pop,pop,uk pop",0.675,0.562,9,-5.99,1,0.0968,0.245,0.00109,0.103,0.655,79.916,1,2021,4QyoBbMlYdgUA64lRHzQRj
30y5OpD8TPAru2wsyZDD4S,That Funny Feeling,That Funny Feeling,Phoebe Bridgers,10/04/2021,400565,71,frank.gibase,2021-10-05T14:43:40Z,"indie pop,la indie",0.515,0.298,4,-11.499,1,0.0311,0.718,0.00000917,0.365,0.462,116.761,4,2021,5NTX91pTinSo9FZyW8WStG
3ArnNhm8z0ScjDKfGHSBRk,Hard Drive,An Overview on Phenomenal Nature,Cassandra Jenkins,02/19/2021,327440,50,frank.gibase,2021-02-19T15:06:40Z,"art pop,chamber pop,chamber psych,freak folk,indie folk,indie pop",0.589,0.627,9,-11.463,1,0.0359,0.299,0.566,0.0747,0.555,106.999,4,2021,5NTX91pTinSo9FZyW8WStG
3Cb8XH0Aa2joQIWKNKVlQ8,taking the heat,in defense of my own happiness,Joy Oladokun,06/04/2021,197520,35,molly.verrone,2021-06-04T16:56:40Z,"black americana,indie folk,indiecoustica,la pop,neo mellow",0.546,0.426,5,-8.433,1,0.0416,0.707,0.000111,0.112,0.232,79.881,4,2021,4QyoBbMlYdgUA64lRHzQRj
3DydI7vEHRh15tntt2aWJY,PradadaBang,USEE4YOURSELF,"IDK,Young Thug",06/04/2021,145897,52,trey.mcmillon,2021-12-08T19:46:16Z,"dmv rap,hip hop,rap,trap,underground hip hop,atl hip hop,atl trap,gangster rap,melodic rap",0.85,0.615,9,-6.6,0,0.271,0.0329,0,0.429,0.546,120.053,4,2021,41UsNnbA7eDB3yVhEBu4ul
3EPSnqfDkva43w9NdrfFmU,Change,I Don’t Live Here Anymore,The War On Drugs,10/29/2021,364333,64,frank.gibase,2021-12-07T02:31:36Z,"indie rock,philly indie",0.605,0.731,10,-6.938,1,0.0265,0.00391,0.25,0.368,0.638,123.986,4,2021,5NTX91pTinSo9FZyW8WStG
3iO9HBIBWvHwm7F6ZqYWNb,INDECISIVE,TEMPORARY HIGHS IN THE VIOLET SKIES,Snoh Aalegra,07/09/2021,195040,61,trey.mcmillon,2021-12-02T00:26:56Z,"alternative r&b,chill r&b,indie r&b,pop,r&b,scandinavian r&b,swedish soul",0.431,0.464,1,-6.087,0,0.16,0.439,0.0024,0.133,0.386,187.663,4,2021,41UsNnbA7eDB3yVhEBu4ul
3Jrk9luBt9SfHk96RJ08bJ,Once Twice Melody,Once Twice Melody,Beach House,12/08/2021,284906,56,frank.gibase,2021-12-15T01:39:27Z,"art pop,baltimore indie,dream pop,dreamo,modern dream pop",0.354,0.739,7,-11.031,0,0.0343,0.386,0.854,0.134,0.435,168.239,4,2021,5NTX91pTinSo9FZyW8WStG
3JXebpWufTcs8iegiRCBW7,Tick Tock,Tick Tock,Young Thug,08/20/2021,159240,66,trey.mcmillon,2021-12-10T21:26:37Z,"atl hip hop,atl trap,gangster rap,hip hop,melodic rap,rap,trap",0.944,0.693,11,-8.605,0,0.266,0.00789,0,0.164,0.626,134.061,4,2021,41UsNnbA7eDB3yVhEBu4ul
3Kkjo3cT83cw09VJyrLNwX,Oh My God,30,Adele,11/19/2021,225148,94,molly.verrone,2021-12-03T17:34:35Z,"british soul,pop,pop soul,uk pop",0.534,0.725,1,-3.906,1,0.046,0.091,0,0.0264,0.55,88.098,4,2021,4QyoBbMlYdgUA64lRHzQRj
3p2wS6G159mBIU50xl7uvc,Future Starts Now,Future Starts Now,Kim Petras,08/27/2021,279270,67,frank.gibase,2021-10-29T21:48:30Z,"art pop,dance pop,electropop,escape room,pop,post-teen pop,transpop",0.693,0.853,6,-4.241,1,0.0503,0.00329,0.000193,0.123,0.432,119.948,4,2021,5NTX91pTinSo9FZyW8WStG
3QFInJAm9eyaho5vBzxInN,family ties (with Kendrick Lamar),The Melodic Blue,"Baby Keem,Kendrick Lamar",09/10/2021,252262,80,trey.mcmillon,2021-12-01T18:37:29Z,"hip hop,rap,conscious hip hop,west coast rap",0.711,0.611,1,-5.453,1,0.33,0.00588,0,0.23,0.144,134.093,4,2021,41UsNnbA7eDB3yVhEBu4ul
3RaT22zZsxVYxxKR7TAaYF,"no body, no crime (feat. HAIM)",evermore,Taylor Swift;HAIM,12/11/2020,215626,63,molly.verrone,2021-12-16T14:56:56Z,"pop,art pop,dance pop,indie pop,metropopolis,pop rock",0.546,0.613,7,-7.589,0,0.0264,0.418,0,0.103,0.535,79.015,4,2021,4QyoBbMlYdgUA64lRHzQRj
41YZXlOIGKmaa3RJpBn2Qy,Little Things,Little Things/Sparrow,Big Thief,08/10/2021,344822,54,frank.gibase,2021-08-11T13:09:45Z,"art pop,brooklyn indie,indie folk,indie pop,indie rock,small room",0.34,0.924,1,-5.077,1,0.0347,0.256,0.925,0.248,0.736,96.104,4,2021,5NTX91pTinSo9FZyW8WStG
46oHvXwpEZOFX518we1nJD,CORSO,CALL ME IF YOU GET LOST,Tyler The Creator,06/25/2021,146481,73,trey.mcmillon,2021-11-22T21:36:07Z,"hip hop,rap",0.703,0.845,10,-4.851,0,0.337,0.169,0,0.122,0.745,97.672,4,2021,41UsNnbA7eDB3yVhEBu4ul
4btFHqumCO31GksfuBLLv3,Overpass Graffiti,=,Ed Sheeran,10/29/2021,236906,90,molly.verrone,2021-12-16T14:57:14Z,"pop,uk pop",0.52,0.849,9,-3.794,0,0.186,0.00253,0,0.119,0.774,175.908,4,2021,4QyoBbMlYdgUA64lRHzQRj
4cktbXiXOapiLBMprHFErI,Memories,JORDI (Deluxe),Maroon 5,06/11/2021,189486,88,molly.verrone,2021-12-16T14:44:37Z,"pop,pop rock",0.775,0.327,11,-7.241,1,0.0557,0.841,0,0.0821,0.595,91.05,4,2021,4QyoBbMlYdgUA64lRHzQRj
4iJyoBOLtHqaGxP12qzhQI,Peaches (feat. Daniel Caesar & Giveon),Justice,"Justin Bieber,Daniel Caesar,Giveon",03/19/2021,198081,92,molly.verrone,2021-06-04T16:15:17Z,"canadian pop,pop,canadian contemporary r&b,r&b",0.677,0.696,0,-6.181,1,0.119,0.321,0,0.42,0.464,90.03,4,2021,4QyoBbMlYdgUA64lRHzQRj
4IQkfUsrwXol38VV3U7t7T,Run (feat. Ed Sheeran) (Taylor’s Version) (From The Vault),Red (Taylor's Version),"Taylor Swift,Ed Sheeran",11/12/2021,240226,85,molly.verrone,2021-12-16T14:55:55Z,"pop,uk pop",0.61,0.488,3,-6.918,1,0.0293,0.817,0,0.312,0.443,125.039,4,2021,4QyoBbMlYdgUA64lRHzQRj
4KD0lLJ4OGonZhBeKtct9I,Avalanche,Culture III,Migos,06/11/2021,206271,65,trey.mcmillon,2021-12-08T19:26:24Z,"atl hip hop,pop rap,rap,trap",0.917,0.623,1,-8.231,1,0.135,0.0985,0,0.0833,0.687,126.063,4,2021,41UsNnbA7eDB3yVhEBu4ul
4ksPH6sLYv9EJ2bXbT8iQH,AN ITERATION,ULTRAPOP,The Armed,04/16/2021,173154,43,frank.gibase,2021-12-15T19:23:04Z,"mathcore,modern rock",0.268,0.964,8,-4.944,0,0.129,0.0000591,0.833,0.73,0.174,164.058,4,2021,5NTX91pTinSo9FZyW8WStG
4L5IkQpsDTx5Ug7hvMrsx1,The Other Side,Heaux Tales,Jazmine Sullivan,01/08/2021,217706,54,trey.mcmillon,2021-12-08T19:02:05Z,"alternative r&b,dance pop,hip pop,neo soul,pop,pop r&b,pop rap,r&b,urban contemporary",0.561,0.621,11,-4.207,0,0.0424,0.0562,0,0.221,0.435,125.005,4,2021,41UsNnbA7eDB3yVhEBu4ul
4ReJJcpW8HtVnqzhf6DwNV,Close To You,Close To You,Dayglow,01/11/2021,194693,69,trey.mcmillon,2021-12-15T00:30:40Z,"austindie,indie pop,modern rock",0.875,0.649,6,-5.754,1,0.0433,0.429,0.00237,0.0704,0.833,140.031,4,2021,41UsNnbA7eDB3yVhEBu4ul
4Y9BJZccHjVdHUkee0pBRa,We Win (Space Jam: A New Legacy) (and Kirk Franklin),We Win (Space Jam: A New Legacy),"Lil Baby,Kirk Franklin",05/21/2021,194999,53,trey.mcmillon,2021-12-08T16:00:03Z,"atl hip hop,atl trap,rap,trap,gospel,gospel r&b",0.448,0.921,1,-3.609,1,0.365,0.0184,0,0.748,0.42,83.762,4,2021,41UsNnbA7eDB3yVhEBu4ul
4ZtFanR9U6ndgddUvNcjcG,good 4 u,SOUR,Olivia Rodrigo,05/21/2021,178146,96,molly.verrone,2021-06-04T16:15:12Z,pop,0.563,0.664,9,-5.044,1,0.154,0.335,0,0.0849,0.688,166.928,4,2021,4QyoBbMlYdgUA64lRHzQRj
5BQHyj5Pb3dUY8W6TSjeTF,Waves of Blue,Waves of Blue,Majid Jordan,04/09/2021,208746,67,trey.mcmillon,2021-12-08T19:19:43Z,"alternative r&b,canadian contemporary r&b,pop,r&b,trap soul",0.652,0.861,6,-4.863,0,0.0565,0.00743,0.0000225,0.337,0.333,99.983,4,2021,41UsNnbA7eDB3yVhEBu4ul
5c549LWiKCWGvcDsZwMN6v,Soundgasm,Soundgasm,Rema,06/10/2021,204755,74,molly.verrone,2021-06-14T16:50:17Z,nigerian pop,0.805,0.525,6,-7.376,0,0.0638,0.119,0.00203,0.0779,0.693,100.033,4,2021,4QyoBbMlYdgUA64lRHzQRj
5CM1jEYAsLwhhQEUYwEBs7,king of the nosebleeds,king of the nosebleeds,gabriel black,04/08/2021,162997,47,molly.verrone,2021-04-11T15:23:24Z,modern alternative pop,0.549,0.502,10,-6.781,1,0.0308,0.339,0,0.122,0.371,157.041,4,2021,4QyoBbMlYdgUA64lRHzQRj
5DTBPQRHrBOnvzIF5XLBPq,September,It'll All Make Sense In The End,James Arthur,11/05/2021,220811,66,molly.verrone,2021-06-14T16:47:42Z,"pop,talent show,uk pop",0.643,0.547,9,-6.06,1,0.0396,0.13,0,0.0927,0.416,102.989,4,2021,4QyoBbMlYdgUA64lRHzQRj
5hVKXeJg1R9qGbrGW5eHNl,Reach Out,Reach Out / Olympus,"Sufjan Stevens,Angelo De Augustine",07/07/2021,223344,50,frank.gibase,2021-07-14T01:52:50Z,"baroque pop,chamber pop,freak folk,indie folk,singer-songwriter,indie pop,small room",0.562,0.315,0,-14.286,1,0.0395,0.928,0.0000179,0.11,0.324,82.982,4,2021,5NTX91pTinSo9FZyW8WStG
5iMRhOHzze2CujxHiJ6cRL,Street Runner,SoulFly,Rod Wave,03/26/2021,252021,73,trey.mcmillon,2021-12-14T15:59:25Z,florida rap,0.599,0.61,5,-8.633,0,0.24,0.213,0.000414,0.151,0.434,159.933,4,2021,41UsNnbA7eDB3yVhEBu4ul
5kUgMxXcpAdsnKumXs4J5Z,2010,2010,Earl Sweatshirt,11/19/2021,148027,69,frank.gibase,2021-11-20T19:55:23Z,"alternative hip hop,experimental hip hop,hip hop,rap,underground hip hop",0.823,0.79,7,-5.861,0,0.431,0.33,0.000001,0.262,0.545,105.476,4,2021,5NTX91pTinSo9FZyW8WStG
5Ne1q9Hv3l2NHBA3Agt8WT,Wave of You,Wave of You,Surfaces,04/09/2021,213842,73,molly.verrone,2021-04-10T14:42:10Z,"bedroom soul,pop",0.695,0.656,1,-6.038,1,0.0489,0.057,0,0.267,0.346,90.986,4,2021,4QyoBbMlYdgUA64lRHzQRj
5qXwFOkT3lrEonTzsYCeZ1,I Can Only Whisper (feat. BADBADNOTGOOD),ALPHA,"Charlotte Day Wilson,BADBADNOTGOOD",07/09/2021,164693,60,trey.mcmillon,2021-11-22T21:35:38Z,"alternative r&b,canadian contemporary r&b,indie r&b,indie soul,neo soul,alternative hip hop,canadian modern jazz,escape room,hip hop",0.611,0.446,2,-9.297,1,0.0355,0.192,0.0363,0.281,0.465,84.938,4,2021,41UsNnbA7eDB3yVhEBu4ul
5rAxxKYX4rlon81fxajuZq,benadryl submarine,volcanic bird enemy and the voiced concern,Lil Ugly Mane,10/12/2021,220306,48,frank.gibase,2021-11-05T23:57:54Z,"alternative hip hop,escape room,psychedelic hip hop,underground hip hop,virginia hip hop",0.673,0.906,5,-5.813,1,0.0406,0.0585,0.22,0.472,0.931,110.019,4,2021,5NTX91pTinSo9FZyW8WStG
5wJ9sSG7NItwu34jMnyxqa,Liz,Liz,Remi Wolf,06/01/2021,175866,70,trey.mcmillon,2021-12-02T00:27:30Z,"indie pop,modern alternative pop",0.665,0.788,5,-3.889,0,0.0857,0.142,0,0.317,0.63,80.476,4,2021,41UsNnbA7eDB3yVhEBu4ul
5XMtZsNkezcv695DQSZo0L,Awake,Hope For Sale,"Chiiild,Mahalia",07/23/2021,226733,59,trey.mcmillon,2021-12-02T00:17:45Z,"alternative r&b,indie r&b,chill r&b,dance pop,indie anthem-folk,indie soul,pop,r&b,uk contemporary r&b",0.519,0.58,0,-7.439,0,0.0439,0.33,0.0575,0.113,0.692,83.978,4,2021,41UsNnbA7eDB3yVhEBu4ul
5YqdiryRmdAzYFlxo43hAJ,Missing Piece,Missing Piece,Vance Joy,05/19/2021,217408,79,molly.verrone,2021-12-16T14:52:54Z,"folk-pop,modern rock,pop,pop rock",0.628,0.877,0,-4.205,1,0.046,0.0155,0.00000597,0.113,0.721,101.992,4,2021,4QyoBbMlYdgUA64lRHzQRj
5zNW5ARjYhJQJz1AChP33n,Thot Shit,Thot Shit,Megan Thee Stallion,06/11/2021,184634,82,molly.verrone,2021-06-14T16:27:32Z,"houston rap,pop,trap queen",0.95,0.693,9,-3.424,1,0.0898,0.0133,0,0.173,0.891,130.02,4,2021,4QyoBbMlYdgUA64lRHzQRj
63pFLvQZDCoFjkX4cQ553L,How Many,1176,"Guapdad 4000,!llmind",03/19/2021,205124,42,trey.mcmillon,2021-12-02T00:07:12Z,"cali rap,oakland hip hop,pop rap,scam rap,trap soul,underground hip hop,vapor trap",0.83,0.492,6,-8.611,0,0.0482,0.197,0.000071,0.257,0.619,102.994,4,2021,41UsNnbA7eDB3yVhEBu4ul
6aDsgHPZsMztSbZernzlF8,Someday,Human (Deluxe),OneRepublic,08/27/2021,187888,81,molly.verrone,2021-12-03T17:52:54Z,"dance pop,neo mellow,piano rock,pop,pop rock",0.576,0.679,0,-7.237,1,0.034,0.0311,0,0.323,0.213,121.005,4,2021,4QyoBbMlYdgUA64lRHzQRj
6AwhhAhVLPvaDYmfR4j3bQ,Bonafide (feat. Chiiild),The Juicebox,"Emotional Oranges,Chiiild",06/11/2021,177409,58,trey.mcmillon,2021-11-23T15:51:20Z,"alternative r&b,chill r&b,indie r&b",0.722,0.442,2,-10.362,0,0.0714,0.518,0.0463,0.0486,0.597,97.977,4,2021,41UsNnbA7eDB3yVhEBu4ul
6Hfu9sc7jvv6coyy2LlzBF,Hurricane,Donda,Kanye West,08/29/2021,243187,85,frank.gibase,2021-12-15T01:39:04Z,"chicago rap,rap",0.587,0.561,0,-6.569,1,0.146,0.0466,0,0.109,0.351,80.009,4,2021,5NTX91pTinSo9FZyW8WStG
6jezfOPKkARrn1J8AwHTE4,Track X,For the first time,"Black Country, New Road",02/05/2021,284480,52,frank.gibase,2021-02-11T15:04:59Z,"art pop,chamber psych,freak folk,indie rock,london indie,modern alternative rock,uk post-punk revival",0.476,0.378,2,-14.94,1,0.0415,0.893,0.879,0.118,0.304,173.074,3,2021,5NTX91pTinSo9FZyW8WStG
6kzOcTc6tPdVrc5SaHD0PS,This Fractured Mind,This Fractured Mind,Nation of Language,08/05/2021,320980,29,frank.gibase,2021-10-01T22:10:50Z,"brooklyn indie,chamber psych",0.632,0.577,5,-7.472,1,0.0506,0.038,0.443,0.0856,0.906,156.039,4,2021,5NTX91pTinSo9FZyW8WStG
6OcCk1dbAb7XNHsC098oEM,I Quit Drinking,I Quit Drinking,"Kelsea Ballerini,LANY",06/09/2021,171200,77,molly.verrone,2021-06-14T16:31:23Z,"contemporary country,country,pop,la pop",0.607,0.418,1,-6.997,1,0.0363,0.394,0,0.182,0.386,95.002,4,2021,4QyoBbMlYdgUA64lRHzQRj
6pYwEd1HNmGaHZvlzw3O6Y,I Hear You Calling,I Hear You Calling,Kevin Morby,12/13/2021,230068,39,frank.gibase,2021-12-13T16:22:25Z,"freak folk,indie folk,indie pop,indie rock,kc indie,modern folk rock",0.637,0.484,7,-11.58,1,0.0285,0.687,0.00706,0.263,0.513,120.065,4,2021,5NTX91pTinSo9FZyW8WStG
6s3UHVDqqqNHa1HyynG4VI,SYNCOPATE,SYNCOPATE,MICHELLE,09/14/2021,118168,59,trey.mcmillon,2021-11-23T15:51:27Z,"bedroom pop,indie pop,indie r&b",0.853,0.654,9,-5.614,0,0.0789,0.0106,0.00283,0.102,0.685,104.012,4,2021,41UsNnbA7eDB3yVhEBu4ul
6snYsavG9vq3C7RGN98dst,Gang Signs (feat. ScHoolboy Q),Gang Signs (feat. ScHoolboy Q),"Freddie Gibbs,ScHoolboy Q",02/05/2021,166840,67,trey.mcmillon,2021-12-02T00:28:34Z,"alternative hip hop,hip hop,indiana hip hop,rap,southern hip hop,trap,underground hip hop,gangster rap,pop rap",0.626,0.615,1,-6.142,1,0.346,0.265,0,0.0812,0.611,52.145,3,2021,41UsNnbA7eDB3yVhEBu4ul
6VFKuuqSbA1GpMEosUgTwQ,Nobody But You,Nobody But You,"Sonder,Jorja Smith",04/09/2021,213214,76,trey.mcmillon,2021-12-08T15:54:52Z,"alternative r&b,r&b,dance pop,pop,uk contemporary r&b",0.637,0.299,7,-11.314,1,0.0366,0.742,0,0.359,0.364,83.872,4,2021,41UsNnbA7eDB3yVhEBu4ul
6w8XLI2OnMRxwYi5SX5YGZ,Spud Infinity,No Reason / Spud Infinity,Big Thief,12/14/2021,334802,40,frank.gibase,2021-12-15T01:18:22Z,"art pop,brooklyn indie,indie folk,indie pop,indie rock,small room",0.562,0.633,10,-6.228,1,0.0331,0.157,0.000419,0.16,0.562,132.122,4,2021,5NTX91pTinSo9FZyW8WStG
6y6bUurXB0FfhddEU5Qch0,The Only Heartbreaker,The Only Heartbreaker,Mitski,11/09/2021,184549,72,frank.gibase,2021-11-10T23:44:50Z,"brooklyn indie,indie pop",0.477,0.747,11,-7.188,1,0.0333,0.00437,0.011,0.158,0.578,150.997,4,2021,5NTX91pTinSo9FZyW8WStG
6yWn9RKfL1il1b4hFe6H1i,Something Tells Me,Thrilled To Be Here,BAILEN,04/26/2019,241120,58,molly.verrone,2021-04-20T23:31:42Z,,0.663,0.381,5,-9.129,0,0.0346,0.362,0.000321,0.131,0.24,120.057,4,2021,4QyoBbMlYdgUA64lRHzQRj
75QktuEju5vz9lyXiLaUao,New Again,Donda,Kanye West,08/29/2021,183296,71,trey.mcmillon,2021-12-15T00:19:20Z,"chicago rap,rap",0.67,0.675,6,-4.624,0,0.179,0.0581,0,0.433,0.263,90.948,4,2021,41UsNnbA7eDB3yVhEBu4ul
7888F1QWPTn4cPbuknNV4T,HIT EM WHERE IT HURTS,HIT EM WHERE IT HURTS,PawPaw Rod,09/18/2020,165499,67,trey.mcmillon,2021-12-02T00:04:21Z,indie r&b,0.779,0.721,6,-6.371,1,0.214,0.122,0.00252,0.0765,0.822,178.046,4,2021,41UsNnbA7eDB3yVhEBu4ul
7fjNxhYa8qXGhrrJhY3hZL,Bound (with Blood Orange),Bound (with Blood Orange),"Wet,Blood Orange",10/20/2021,220332,59,trey.mcmillon,2021-12-02T00:13:29Z,"alternative r&b,art pop,brooklyn indie,electropop,indie pop,indie poptimism,nyc pop,vapor soul,chillwave,indie soul,metropopolis",0.629,0.515,10,-10.128,0,0.0785,0.172,0.133,0.144,0.27,191.706,4,2021,41UsNnbA7eDB3yVhEBu4ul
7fRCD4vVNpCy91Y3zxNMUl,Stop Making This Hurt,Take the Sadness Out of Saturday Night,Bleachers,07/30/2021,199626,58,trey.mcmillon,2021-12-15T02:02:01Z,"double drumming,indie pop,indie poptimism,modern alternative rock,modern rock,pop rock",0.669,0.885,0,-4.735,1,0.0438,0.0393,0,0.264,0.825,109.24,4,2021,41UsNnbA7eDB3yVhEBu4ul
7hINOWdRK2rAWDKmjXTHth,Paprika,Jubilee,Japanese Breakfast,06/04/2021,220316,25,frank.gibase,2021-06-14T18:52:14Z,"art pop,eugene indie,indie pop,philly indie",0.505,0.705,4,-5.477,1,0.0333,0.0209,0,0.304,0.413,120.073,4,2021,5NTX91pTinSo9FZyW8WStG
7zLMYtNJcabv4h4wBnjNQI,M3tamorphosis (feat. Kid Cudi),Whole Lotta Red,"Playboi Carti,Kid Cudi",12/25/2020,312256,72,frank.gibase,2021-01-13T14:59:01Z,"atl hip hop,plugg,rap,trap,hip hop,ohio hip hop,pop rap",0.657,0.604,0,-6.045,1,0.0374,0.0213,0,0.156,0.122,73.933,4,2021,5NTX91pTinSo9FZyW8WStG
7zTBtHMIKYn9RA3bx9Sq9q,star-crossed,star-crossed,Kacey Musgraves,08/23/2021,199226,37,frank.gibase,2021-08-23T19:46:28Z,"contemporary country,country dawn,pop,texas country",0.378,0.441,2,-9.142,0,0.0355,0.709,0.00288,0.0887,0.158,105.905,4,2021,5NTX91pTinSo9FZyW8WStG
0BiqmkasE5FdrChwKfVp8X,Bigger Than The Whole Sky,Midnights (3am Edition),Taylor Swift,10/22/2022,218502,85,molly.verrone,2022-12-08T18:28:54Z,pop,0.422,0.235,6,-12.379,1,0.0568,0.826,0.00648,0.115,0.068,165.71,4,2022,72MsjN8SKouSf5yt8XcOk8
0QBzMgT7NIeoCYy3sJCof1,Bam Bam (feat. Ed Sheeran),Bam Bam (feat. Ed Sheeran),"Camila Cabello,Ed Sheeran",03/04/2022,206070,83,molly.verrone,2022-12-08T18:40:26Z,"dance pop,pop,post-teen pop,uk pop",0.756,0.697,8,-6.377,1,0.0401,0.182,0,0.333,0.956,94.996,4,2022,72MsjN8SKouSf5yt8XcOk8
0U1W2LZVUX7qTm7dDpqxh6,When You're Gone,When You're Gone,Shawn Mendes,03/31/2022,172266,81,molly.verrone,2022-04-01T16:07:00Z,"canadian pop,dance pop,pop,viral pop",0.603,0.691,5,-5.805,1,0.0372,0.0248,0,0.583,0.577,147.148,4,2022,72MsjN8SKouSf5yt8XcOk8
0X6hQ8VqX1bKNn5eyT9sNF,Holding Back,Serpentina,BANKS,04/08/2022,232758,54,trey.mcmillon,2022-12-12T03:15:41Z,electropop,0.333,0.746,1,-3.615,0,0.171,0.0126,0,0.352,0.341,187.516,4,2022,3szGfOlC6IAzXTnuhlEg0v
0Yc0ziTsyjahYqlWXVXlTU,BAILÉ CON MI EX,BAILÉ CON MI EX,Becky G,05/10/2022,161880,71,molly.verrone,2022-05-13T18:58:13Z,"dance pop,latin pop,latin viral pop,pop,rap latina,reggaeton",0.761,0.784,4,-4.977,1,0.133,0.15,0,0.125,0.691,114.93,4,2022,72MsjN8SKouSf5yt8XcOk8
0YMe6PHRbeDcN7KJdCG0bW,The Dress,Absolutely,Dijon,11/05/2021,184767,70,trey.mcmillon,2022-12-12T03:15:41Z,"bedroom soul,indie r&b",0.747,0.531,8,-5.99,1,0.0477,0.266,0.0000018,0.192,0.785,88.009,4,2022,3szGfOlC6IAzXTnuhlEg0v
14dJexYlvd3t3XAtD1pYW1,Oh Caroline,Being Funny In A Foreign Language,The 1975,10/14/2022,212568,77,trey.mcmillon,2022-12-12T03:15:41Z,"modern alternative rock,modern rock,pop,rock",0.646,0.85,2,-5.466,1,0.0428,0.363,0.0000401,0.0994,0.819,96.538,4,2022,3szGfOlC6IAzXTnuhlEg0v
1dTkx1nSrcMSUoGffsn07A,Anxious - Bonus Track,The Loneliest Time,Carly Rae Jepsen,10/21/2022,177466,59,trey.mcmillon,2022-12-12T03:15:41Z,"canadian pop,dance pop,electropop,pop,post-teen pop",0.69,0.71,8,-5.819,1,0.0338,0.000484,0.0208,0.104,0.515,115.088,4,2022,3szGfOlC6IAzXTnuhlEg0v
1fgMGkGIzpjpwsqp85FDJP,Change the Locks,Hold On Baby,King Princess,07/29/2022,269784,49,trey.mcmillon,2022-12-12T03:15:41Z,"alt z,art pop,electropop,indie pop,indie poptimism,nyc pop,pop",0.589,0.505,5,-7.803,1,0.0305,0.513,0,0.119,0.279,108.968,4,2022,3szGfOlC6IAzXTnuhlEg0v
1jgkW7D0uUveWxfRPNC2PY,Lovesick,Lovesick,"Haydon,Zach Paradis",09/30/2022,168688,22,molly.verrone,2022-12-08T18:14:25Z,,0.563,0.373,9,-12.575,1,0.0351,0.764,0.0000023,0.201,0.315,121.772,4,2022,72MsjN8SKouSf5yt8XcOk8
1K9yH9EpJsH2kXWX4ozH68,New Shapes (feat. Christine and the Queens and Caroline Polachek),CRASH,"Charli XCX,Christine and the Queens,Caroline Polachek",03/18/2022,200687,58,trey.mcmillon,2022-12-12T03:15:41Z,"art pop,candy pop,dance pop,electropop,metropopolis,pop,post-teen pop,uk pop,electro-pop francais,shimmer pop,escape room,indie pop,indietronica",0.735,0.74,0,-4.929,1,0.0552,0.111,0,0.032,0.553,107.061,4,2022,3szGfOlC6IAzXTnuhlEg0v
1Ol7rmDYnjXadnWaEvY9em,Adonis - feat. KIRBY,Adonis,"Adi Oasis,KIRBY",11/16/2022,219146,57,trey.mcmillon,2022-12-12T05:17:59Z,"alternative r&b,indie r&b,indie soul,neo soul,chill r&b,high vibe,indie triste",0.491,0.725,6,-4.915,0,0.11,0.0491,0.0000191,0.176,0.761,168.144,4,2022,3szGfOlC6IAzXTnuhlEg0v
1tIgeZloeOtSJrVx9WiArC,HOME,IN DIMES WE TRUST,Mike Dimes,03/08/2022,174915,68,trey.mcmillon,2022-12-12T03:15:41Z,"rap,viral rap",0.895,0.467,0,-5.78,0,0.378,0.347,0,0.214,0.433,118.016,4,2022,3szGfOlC6IAzXTnuhlEg0v
1yGzzCuLd5vH5gSb1Ii6jU,Stereo Driver,Stereo Driver,Q,09/23/2022,231533,59,trey.mcmillon,2022-12-12T03:15:41Z,indie r&b,0.743,0.711,7,-5.953,1,0.0353,0.0198,0.0000575,0.0893,0.842,97.992,4,2022,3szGfOlC6IAzXTnuhlEg0v
21DuXS5wpeO1z0dp445bop,Clarity,In Our Own Sweet Time,Vance Joy,06/10/2022,227240,59,molly.verrone,2022-12-08T18:37:35Z,"folk-pop,pop",0.552,0.873,0,-6.065,1,0.0464,0.00137,0.000273,0.0966,0.62,125.059,4,2022,72MsjN8SKouSf5yt8XcOk8
2jQrCn5lMF1tnICJ0sv1qZ,Tiebreaker,Tiebreaker,The Head And The Heart,03/25/2022,239466,40,molly.verrone,2022-03-25T17:09:07Z,"folk-pop,indie folk,seattle indie,stomp and holler",0.6,0.713,6,-5.238,1,0.0381,0.0765,0.000269,0.575,0.543,133.211,4,2022,72MsjN8SKouSf5yt8XcOk8
2JrkrX1MMmqpwfve5El6Re,Solar Power - Spotify Singles,Spotify Singles,Glass Animals,03/31/2022,173889,58,molly.verrone,2022-04-01T16:06:31Z,"gauze pop,indietronica,shiver pop",0.701,0.631,4,-9.113,1,0.0708,0.0784,0.14,0.694,0.61,110.024,4,2022,72MsjN8SKouSf5yt8XcOk8
2RO4aPByijQUqBZhYm1apz,Call on me (feat. Ed Sheeran),Call on me (feat. Ed Sheeran),"Vianney,Ed Sheeran",10/07/2022,200706,73,molly.verrone,2022-12-08T18:26:47Z,"francoton,french pop,pop,uk pop",0.618,0.66,6,-3.202,1,0.0664,0.116,0,0.0727,0.572,81.023,4,2022,72MsjN8SKouSf5yt8XcOk8
2SJ0exVB6NRWLbdjCsNWAd,Threads,Threads,Indy,09/15/2022,232506,50,trey.mcmillon,2022-12-12T03:15:41Z,,0.638,0.365,0,-12.706,1,0.0586,0.631,0.0268,0.102,0.0697,104.969,4,2022,3szGfOlC6IAzXTnuhlEg0v
35ovElsgyAtQwYPYnZJECg,Lift Me Up - From Black Panther: Wakanda Forever - Music From and Inspired By,Lift Me Up (From Black Panther: Wakanda Forever - Music From and Inspired By),Rihanna,10/28/2022,196519,90,molly.verrone,2022-10-28T17:32:49Z,"barbadian pop,dance pop,pop,urban contemporary",0.247,0.299,9,-6.083,1,0.0315,0.899,0,0.131,0.172,177.115,4,2022,72MsjN8SKouSf5yt8XcOk8
38XLUjlR84JEwK0SOvX77a,Let's go to Hell,Let's go to Hell,Tai Verdes,11/03/2021,152181,67,molly.verrone,2022-12-08T18:38:53Z,"modern indie pop,pop",0.782,0.798,4,-5.07,0,0.0337,0.141,0,0.685,0.905,127.89,4,2022,72MsjN8SKouSf5yt8XcOk8
3cJhvKu04O5akhOHpZmMvP,Couldn’t Be Done (feat. Kelly Price),$oul $old $eparately,"Freddie Gibbs,Kelly Price",09/30/2022,151233,60,trey.mcmillon,2022-12-12T03:15:41Z,"alternative hip hop,hip hop,indiana hip hop,rap,southern hip hop,underground hip hop,contemporary r&b,hip pop,neo soul,quiet storm,r&b,urban contemporary",0.649,0.753,8,-5.496,0,0.109,0.373,0,0.6,0.434,79.975,4,2022,3szGfOlC6IAzXTnuhlEg0v
3eX0NZfLtGzoLUxPNvRfqm,Maroon,Midnights,Taylor Swift,10/21/2022,218270,88,molly.verrone,2022-12-08T18:28:31Z,pop,0.637,0.398,7,-8.294,1,0.0564,0.0573,0.00000103,0.101,0.0374,108.075,4,2022,72MsjN8SKouSf5yt8XcOk8
3ijLtvQmoX17q1wTgU7SiI,Break You Off,Too Late To Die Young,Sonder,10/21/2022,127142,62,trey.mcmillon,2022-12-12T03:15:41Z,r&b,0.788,0.394,11,-9.519,1,0.0929,0.797,0,0.535,0.471,105.002,4,2022,3szGfOlC6IAzXTnuhlEg0v
3KVS5CzCxsfQ4iZcOpD7xk,LORD FORGIVE ME,moMINTs,"Tobe Nwigwe,Pharrell Williams,EARTHGANG,Fat Nwigwe",08/07/2022,204000,55,molly.verrone,2022-12-08T18:29:46Z,"christian hip hop,houston rap,hip hop,pop,pop rap,atl hip hop,psychedelic hip hop,rap,underground hip hop",0.934,0.61,4,-8.639,0,0.296,0.292,0.00315,0.0884,0.505,120.024,4,2022,72MsjN8SKouSf5yt8XcOk8
3nbDQdyujeg7dTTSZxVXWO,Shooting Star,The Loneliest Time,Carly Rae Jepsen,10/21/2022,199666,58,trey.mcmillon,2022-12-12T03:15:41Z,"canadian pop,dance pop,electropop,pop,post-teen pop",0.821,0.625,9,-5.864,0,0.0897,0.108,0,0.0282,0.81,113.004,4,2022,3szGfOlC6IAzXTnuhlEg0v
3NktF1rRdORH8FH3p8wKp3,Indonesian Fantasies,Too Late To Die Young,Sonder,10/21/2022,119505,63,trey.mcmillon,2022-12-12T03:15:41Z,r&b,0.789,0.521,1,-7.923,0,0.115,0.0657,0.000155,0.0918,0.529,91.018,4,2022,3szGfOlC6IAzXTnuhlEg0v
3rWDp9tBPQR9z6U5YyRSK4,Midnight Rain,Midnights,Taylor Swift,10/21/2022,174782,90,molly.verrone,2022-12-08T18:24:03Z,pop,0.643,0.363,0,-11.738,1,0.0767,0.69,0.0000517,0.115,0.23,139.865,4,2022,72MsjN8SKouSf5yt8XcOk8
3S68RFe1lsdCdTMPIMJM3X,Cash In Cash Out,Cash In Cash Out,"Pharrell Williams,21 Savage,Tyler The Creator",06/10/2022,216135,78,trey.mcmillon,2022-12-12T03:15:41Z,"hip hop,pop,pop rap,atl hip hop,rap",0.877,0.56,7,-3.751,1,0.0596,0.00721,0.00000145,0.0839,0.154,119.971,4,2022,3szGfOlC6IAzXTnuhlEg0v
3uTdOMyG1ixtUxdtspkngM,Midnight,Midnight,Rhys Lewis,09/23/2022,228066,57,molly.verrone,2022-12-12T21:04:43Z,"neo mellow,pop,uk pop",0.636,0.738,1,-6.747,1,0.0444,0.103,0,0.248,0.448,135.974,4,2022,72MsjN8SKouSf5yt8XcOk8
3WbnLPTQUXZqKWg9fi7FDr,Misunderstood,Serpentina,BANKS,04/08/2022,101600,45,trey.mcmillon,2022-12-12T03:15:41Z,electropop,0.466,0.404,3,-7.596,1,0.0492,0.0783,0.000017,0.099,0.254,75.482,4,2022,3szGfOlC6IAzXTnuhlEg0v
3WMj8moIAXJhHsyLaqIIHI,Something in the Orange,Something in the Orange,Zach Bryan,04/22/2022,228013,89,molly.verrone,2022-05-26T18:26:36Z,oklahoma country,0.369,0.192,4,-12.151,0,0.04,0.555,0.00000835,0.0954,0.148,175.212,3,2022,72MsjN8SKouSf5yt8XcOk8
3xqtvSfofDvSMVwwSbuvKi,careless (feat. daniel caesar),CAPRISONGS,"FKA twigs,Daniel Caesar",01/14/2022,216760,56,trey.mcmillon,2022-12-12T16:46:41Z,"afrofuturism,alternative r&b,art pop,escape room,experimental r&b,pop,trip hop,canadian contemporary r&b,r&b",0.706,0.395,11,-6.952,0,0.0588,0.724,0.0000216,0.203,0.26,118.128,4,2022,3szGfOlC6IAzXTnuhlEg0v
40gooTta3y4FgzXaMOGDJL,I Can't Help But Feel,I Can't Help But Feel,Surfaces,04/01/2022,178780,63,molly.verrone,2022-04-01T16:49:34Z,"bedroom soul,pop",0.722,0.706,1,-4.552,0,0.0314,0.328,0,0.108,0.715,114.983,4,2022,72MsjN8SKouSf5yt8XcOk8
4d53iJvfGbPyQGRnbtmtiW,Leave It,What If? / Leave It,"Lil Silva,Charlotte Day Wilson",06/29/2022,232500,44,trey.mcmillon,2022-12-12T03:15:41Z,"alternative r&b,future garage,indie r&b,indie soul,uk bass,uk funky,vogue,canadian contemporary r&b,neo soul",0.602,0.515,5,-11.397,0,0.0538,0.351,0.00179,0.167,0.4,91.573,4,2022,3szGfOlC6IAzXTnuhlEg0v
4Dvkj6JhhA12EX05fT7y2e,As It Was,Harry's House,Harry Styles,05/20/2022,167303,93,molly.verrone,2022-04-01T16:06:42Z,pop,0.52,0.731,6,-5.338,0,0.0557,0.342,0.00101,0.311,0.662,173.93,4,2022,72MsjN8SKouSf5yt8XcOk8
4KGTM5EQEWR1QMDvo8dzaZ,dose,dose,Teddy Swims,04/15/2022,180807,51,molly.verrone,2022-05-26T18:33:34Z,,0.75,0.581,4,-5.011,1,0.0437,0.302,0,0.153,0.612,119.995,4,2022,72MsjN8SKouSf5yt8XcOk8
4QUzLCXrpHO4c6dGyZlpO2,killer,killer,FKA twigs,06/16/2022,176876,59,trey.mcmillon,2022-12-12T03:15:41Z,"afrofuturism,alternative r&b,art pop,escape room,experimental r&b,pop,trip hop",0.401,0.619,0,-7.035,0,0.21,0.168,0,0.272,0.757,78.763,4,2022,3szGfOlC6IAzXTnuhlEg0v
4W1JavoraGzh83nluQHY6C,You Were Loved (with OneRepublic),You Were Loved (with OneRepublic),"Gryffin,OneRepublic",04/01/2022,221885,66,molly.verrone,2022-04-01T16:06:16Z,"dance pop,edm,pop,pop dance,tropical house,piano rock",0.636,0.69,10,-5.011,1,0.0484,0.0947,0,0.169,0.444,123.994,4,2022,72MsjN8SKouSf5yt8XcOk8
4xIhSUJantE6BMl3u8dtCJ,Father Time (feat. Sampha),Mr. Morale & The Big Steppers,"Kendrick Lamar,Sampha",05/13/2022,222497,19,trey.mcmillon,2022-12-12T03:15:41Z,"conscious hip hop,hip hop,rap,west coast rap,indie soul",0.514,0.779,10,-4.365,0,0.344,0.181,0,0.099,0.517,152.869,4,2022,3szGfOlC6IAzXTnuhlEg0v
4XQ4LiJPSQXOxa3ap31Z4g,Cannibal,(self-titled),Marcus Mumford,09/16/2022,240666,49,molly.verrone,2022-12-08T18:31:58Z,british singer-songwriter,0.444,0.21,0,-11.998,1,0.0838,0.145,0.013,0.158,0.576,138.238,4,2022,72MsjN8SKouSf5yt8XcOk8
5AwYKIFP390CdH7XAS4k8z,Web,You Can’t Kill Me,070 Shake,06/03/2022,126151,52,trey.mcmillon,2022-12-12T03:15:41Z,new jersey rap,0.351,0.457,2,-7.456,1,0.0345,0.557,0,0.167,0.164,104.253,4,2022,3szGfOlC6IAzXTnuhlEg0v
5IugC7MdXtCwOtEbUSERkA,QUEEN ST. W,YESSIE,Jessie Reyez,09/16/2022,171818,56,trey.mcmillon,2022-12-12T03:15:41Z,"canadian contemporary r&b,canadian pop,pop,r&b",0.427,0.618,8,-5.659,1,0.0557,0.172,0.0000646,0.163,0.186,82.39,4,2022,3szGfOlC6IAzXTnuhlEg0v
5jQI2r1RdgtuT8S3iG8zFC,Lavender Haze,Midnights,Taylor Swift,10/21/2022,202395,90,trey.mcmillon,2022-12-12T03:15:41Z,pop,0.733,0.436,10,-10.489,1,0.08,0.258,0.000573,0.157,0.0976,96.985,4,2022,3szGfOlC6IAzXTnuhlEg0v
5uJK1i4LU4I5Ai5qCeHonu,Pink + White - Live at Electric Lady,Live at Electric Lady,Remi Wolf,08/04/2022,233406,62,trey.mcmillon,2022-12-12T03:15:41Z,"indie pop,modern alternative pop,pop",0.498,0.468,9,-6.17,1,0.0502,0.133,0,0.103,0.55,148.266,3,2022,3szGfOlC6IAzXTnuhlEg0v
5wG3HvLhF6Y5KTGlK0IW3J,Trance (with Travis Scott & Young Thug),HEROES & VILLAINS,"Metro Boomin,Travis Scott,Young Thug",12/02/2022,194786,79,trey.mcmillon,2022-12-12T03:15:41Z,"rap,slap house,atl hip hop,atl trap,gangster rap,hip hop,melodic rap,pop rap,trap",0.571,0.549,1,-7.38,0,0.404,0.18,0,0.168,0.447,119.497,4,2022,3szGfOlC6IAzXTnuhlEg0v
5WjKzP0MY4COScm6VPrLqU,Overdrive,Surrender,Maggie Rogers,07/29/2022,194933,59,molly.verrone,2022-12-08T18:30:12Z,"indie pop,pop",0.369,0.776,7,-6.188,1,0.0468,0.00474,0.0957,0.0805,0.0924,149.07,4,2022,72MsjN8SKouSf5yt8XcOk8
5xMw6qCcpd2gBXPGTegC4W,SOS,SOS,SZA,12/09/2022,117773,83,trey.mcmillon,2022-12-12T03:15:41Z,"pop,r&b,rap",0.507,0.657,7,-7.356,0,0.233,0.669,0.00000697,0.0947,0.506,119.159,1,2022,3szGfOlC6IAzXTnuhlEg0v
66MhEsUuahsQOxNR4RJv9Z,You - Live,ATTENTION: MILEY LIVE,Miley Cyrus,04/01/2022,181093,60,molly.verrone,2022-04-01T16:07:23Z,"dance pop,pop,post-teen pop",0.447,0.539,6,-5.051,1,0.0317,0.333,0,0.892,0.419,113.225,4,2022,72MsjN8SKouSf5yt8XcOk8
6c1yUgFlhUHLAM9hSDkVBq,YUKON (INTERLUDE),YUKON (INTERLUDE),Joji,08/26/2022,141093,69,trey.mcmillon,2022-12-12T03:15:41Z,viral pop,0.736,0.71,6,-8.497,0,0.091,0.383,0.0351,0.395,0.0728,82.482,4,2022,3szGfOlC6IAzXTnuhlEg0v
6jOfKvLoIdKu7UARpK2sMw,Heart So Big,Heart So Big,"Matoma,A R I Z O N A",04/01/2022,216000,54,molly.verrone,2022-04-01T16:27:24Z,"dance pop,edm,electro house,electropop,norwegian pop,pop,pop dance,pop edm,tropical house,indie poptimism",0.613,0.873,7,-5.553,1,0.0493,0.0116,0.0512,0.118,0.46,104.958,4,2022,72MsjN8SKouSf5yt8XcOk8
6kYGOFNUMxpab09L5Ukoke,Rich Spirit,Mr. Morale & The Big Steppers,Kendrick Lamar,05/13/2022,202285,20,trey.mcmillon,2022-12-12T03:15:41Z,"conscious hip hop,hip hop,rap,west coast rap",0.852,0.421,10,-9.153,0,0.208,0.428,0.00000228,0.106,0.457,95.977,4,2022,3szGfOlC6IAzXTnuhlEg0v
6QAztdj5jtr41PL56WcgvP,The Bomb,Dance Fever,Florence + The Machine,05/13/2022,164566,61,molly.verrone,2022-05-13T18:40:14Z,"baroque pop,pop,uk alternative pop",0.634,0.198,11,-8.68,1,0.0339,0.912,0.0000994,0.0875,0.299,110.79,4,2022,72MsjN8SKouSf5yt8XcOk8
6sg8Y3ZwBdVWF03V7jzHgS,Dreamin's Free,Dreamin's Free,Caitlyn Smith,04/01/2022,218568,23,molly.verrone,2022-04-01T16:15:32Z,"contemporary country,country pop",0.533,0.627,2,-7.343,1,0.0357,0.292,0,0.117,0.336,75.314,4,2022,72MsjN8SKouSf5yt8XcOk8
6XC3zX8dEiFTpd2hPpOA9y,Just So You Remember,It's Almost Dry,Pusha T,04/22/2022,178620,54,trey.mcmillon,2022-12-12T03:15:41Z,"alternative hip hop,hip hop,pop rap,rap,southern hip hop,trap,underground hip hop,virginia hip hop",0.613,0.691,2,-5.899,1,0.296,0.141,0,0.11,0.451,170.437,4,2022,3szGfOlC6IAzXTnuhlEg0v
7z84Fwf1R3Z2BwHCP620CI,This Is Why,This Is Why,Paramore,09/28/2022,207652,76,trey.mcmillon,2022-12-12T03:15:41Z,"candy pop,pixie,pop emo,pop punk",0.723,0.737,11,-7.566,0,0.0386,0.00435,0.00261,0.116,0.689,123.039,4,2022,3szGfOlC6IAzXTnuhlEg0v
08z1Wf8QxqDcVcxux3DvGx,Looking For Love,Alchemy,Disclosure,07/14/2023,2/20/2695,52,frank.gibase,2023-08-04T16:47:49Z,"edm,house,indietronica,uk dance",0.746,0.77,11,-8.614,1,0.0648,0.0183,0.316,0.257,0.581,135.039,4,2023,2cdbrCxgycI5qXBykIRPKr
0AXay1TwLmrkdWpVnHbmpl,Mirror,Mirror,M83,10/16/2023,12/18/2843,36,frank.gibase,2023-11-14T18:14:58Z,"french shoegaze,french synthpop,indietronica,metropopolis,neo-synthpop",0.507,0.976,8,-6.458,1,0.0405,0.000726,0.22,0.26,0.482,125.001,4,2023,2cdbrCxgycI5qXBykIRPKr
0G940894Dzz2GpHAdpAEcw,Fallout,This Stupid World,Yo La Tengo,02/10/2023,7/14/2656,41,frank.gibase,2023-12-11T17:11:51Z,"alternative rock,art pop,dream pop,indie rock,indietronica,lo-fi,new jersey indie,noise pop,permanent wave,shoegaze",0.427,0.778,2,-5.497,1,0.0368,0.305,0.742,0.34,0.485,136.113,4,2023,2cdbrCxgycI5qXBykIRPKr
0qNRoqAohqJefbeZiTV1xF,dazies,softscars,yeule,09/22/2023,2/21/2625,48,frank.gibase,2023-10-05T14:44:29Z,ambient pop,0.304,0.628,4,-5.342,1,0.049,0.00524,0.0102,0.337,0.45,141.946,4,2023,2cdbrCxgycI5qXBykIRPKr
0RD2AT3sAoSLcMxvcjayrQ,All Of A Sudden,All Of A Sudden,The Chemical Brothers,04/28/2023,12/8/2802,39,frank.gibase,2023-08-08T20:23:55Z,"alternative dance,big beat,breakbeat,electronica,rave,trip hop",0.773,0.955,2,-6.461,1,0.0413,0.0273,0.827,0.125,0.304,130.003,4,2023,2cdbrCxgycI5qXBykIRPKr
0ToG55iJZCOzZkcpWbXxpW,Vampire Empire,Vampire Empire,Big Thief,07/19/2023,1/8/2426,70,frank.gibase,2023-07-20T16:36:25Z,"art pop,brooklyn indie,chamber pop,countrygaze,indie pop,indie rock,small room",0.636,0.572,9,-7.797,1,0.0913,0.287,0,0.0878,0.66,131.272,4,2023,2cdbrCxgycI5qXBykIRPKr
1wTopxO5eQBpxrBXPSbsUn,A&W,A&W,Lana Del Rey,02/14/2023,1/7/3088,2,frank.gibase,2023-02-14T20:52:29Z,"art pop,pop",0.416,0.248,10,-14.62,1,0.14,0.647,0.427,0.113,0.134,161.667,4,2023,2cdbrCxgycI5qXBykIRPKr
1XwnEWNCxd7HujfC9ZHPQ2,Cousin,Cousin,Wilco,09/14/2023,3/23/2586,19,frank.gibase,2023-09-28T22:22:43Z,"alternative country,alternative rock,chicago indie,indie rock,roots rock,stomp and holler",0.787,0.762,2,-6.48,1,0.0348,0.0298,0.664,0.0483,0.93,119.774,3,2023,2cdbrCxgycI5qXBykIRPKr
2FRIWWs5xxPoQrk5pMmsQN,Three Drums,Three Drums,Four Tet,04/26/2023,8/10/3257,47,frank.gibase,2023-07-11T20:13:19Z,"electronica,folktronica,indietronica,intelligent dance music,trip hop",0.169,0.44,0,-10.385,1,0.0277,0.149,0.169,0.126,0.113,95.896,4,2023,2cdbrCxgycI5qXBykIRPKr
2GEs9D56FRHqUAEwvlvBpw,Goodbye Evergreen,Javelin,Sufjan Stevens,10/06/2023,10/21/2489,58,frank.gibase,2023-10-16T15:34:39Z,"art pop,baroque pop,chamber pop,indie pop,indie rock,singer-songwriter",0.483,0.427,5,-8.427,1,0.0355,0.554,0.000117,0.186,0.104,115.938,4,2023,2cdbrCxgycI5qXBykIRPKr
2gWvOZCYcau0QlnV9bGyj3,I'll Wait,The Freedom to Fuck Off,Petey,08/29/2023,6/9/2373,20,frank.gibase,2023-09-16T15:40:12Z,indie rock,0.513,0.862,1,-5.164,1,0.0346,0.000146,0.128,0.157,0.394,97.536,4,2023,2cdbrCxgycI5qXBykIRPKr
2hFlY5xuAXrjY24v3a1mpZ,Oceans Niagara,Oceans Niagara,M83,01/10/2023,10/7/2643,0,frank.gibase,2023-01-10T19:44:07Z,"french shoegaze,french synthpop,indietronica,metropopolis,neo-synthpop",0.437,0.666,1,-5.784,1,0.0329,0.0000944,0.854,0.111,0.0343,128.008,4,2023,2cdbrCxgycI5qXBykIRPKr
2KcQ0PbPj0O3P48B9YX7iN,Peaches & Eggplants (feat. 21 Savage),Gumbo,"Young Nudy,21 Savage",02/28/2023,1/6/2458,71,frank.gibase,2023-03-15T20:47:51Z,"pluggnb,rap,trap,atl hip hop,hip hop",0.911,0.536,4,-7.884,0,0.282,0.00897,0.00000373,0.111,0.584,146.014,4,2023,2cdbrCxgycI5qXBykIRPKr
34sOdxWu9FljH84UXdRwu1,all-american bitch,GUTS,Olivia Rodrigo,09/08/2023,1/12/2354,82,frank.gibase,2023-10-03T21:54:03Z,pop,0.43,0.692,6,-4.234,1,0.0429,0.254,0.00000417,0.148,0.401,156.261,4,2023,2cdbrCxgycI5qXBykIRPKr
3ePFWIRZNratB2vjSrSKoP,I Thought You'd Change,Cartwheel,Hotline TNT,11/03/2023,10/7/2368,49,frank.gibase,2023-11-14T18:53:18Z,grungegaze,0.35,0.832,10,-7.682,1,0.0593,0.00000117,0.875,0.244,0.24,125.186,4,2023,2cdbrCxgycI5qXBykIRPKr
3UfLQuWEWM3iPnck9FwddD,Pocket,Girl with Fish,feeble little horse,06/09/2023,10/11/2337,42,frank.gibase,2023-12-01T16:28:52Z,lo-fi indie,0.611,0.512,7,-9.172,0,0.0414,0.689,0,0.102,0.29,131.009,4,2023,2cdbrCxgycI5qXBykIRPKr
4F5hW330E7Db11lAfFF4Kh,Brussel Sprout,Gumbo,Young Nudy,02/28/2023,11/29/2500,49,frank.gibase,2023-03-15T18:50:36Z,"pluggnb,rap,trap",0.803,0.579,8,-7.024,1,0.229,0.48,0,0.115,0.335,140.077,4,2023,2cdbrCxgycI5qXBykIRPKr
55LnC7VuUvayQ3fW0CvDL6,Grandfather please stand on the shoulders of my father while he's deep-sea fishing (feat. RIOPY),Did you know that there's a tunnel under Ocean Blvd,"Lana Del Rey,RIOPY",03/24/2023,11/17/2557,61,frank.gibase,2023-04-04T14:29:48Z,"art pop,pop,neo-classical",0.348,0.224,8,-10.36,1,0.0321,0.936,0.0225,0.297,0.0818,79.608,4,2023,2cdbrCxgycI5qXBykIRPKr
5ipJCn0tOI0qAUwhQ0Onhk,Hunter,Hunter,Jess Williamson,03/28/2023,4/27/2526,0,frank.gibase,2023-04-07T15:59:16Z,"alternative americana,countrygaze",0.778,0.396,7,-8.821,1,0.0316,0.676,0.0081,0.0848,0.46,114.001,4,2023,2cdbrCxgycI5qXBykIRPKr
5KE5Inz4uZKGb2EzETaOEe,Blood And Butter,"Desire, I Want To Turn Into You",Caroline Polachek,02/14/2023,5/21/2632,55,frank.gibase,2023-02-21T16:35:53Z,"art pop,escape room,indie pop,indietronica",0.589,0.682,0,-6.699,1,0.0347,0.229,0.00174,0.0583,0.398,90.027,4,2023,2cdbrCxgycI5qXBykIRPKr
6iKLdREEci9SyzXl9JNUVk,Feel It,Feel It,Amelie Lens,06/02/2023,12/12/2607,59,frank.gibase,2023-12-07T19:42:53Z,"acid techno,belgian techno,dark techno,electra",0.627,0.991,5,-8.524,0,0.0416,0.000549,0.845,0.0789,0.261,144.001,4,2023,2cdbrCxgycI5qXBykIRPKr
7axM6HbfUTu3dXEIWOYcH1,Free Yourself,That! Feels Good!,Jessie Ware,04/28/2023,11/19/2540,58,frank.gibase,2023-07-25T20:08:21Z,"british soul,electropop,neo soul,pop soul,uk pop",0.689,0.915,0,-4.471,0,0.0511,0.00408,0.00000494,0.102,0.752,119.008,4,2023,2cdbrCxgycI5qXBykIRPKr
7HnhWYSC2OLwfDQB3L5K3Q,Carbon Dioxide,Radical Romantics,Fever Ray,03/10/2023,6/10/2698,32,frank.gibase,2023-03-10T17:22:20Z,"alternative dance,art pop,dark pop,electronica,neo-synthpop,swedish electropop,swedish synth,swedish synthpop",0.602,0.722,1,-7.721,1,0.0321,0.000705,0.00271,0.19,0.238,137.999,4,2023,2cdbrCxgycI5qXBykIRPKr
7K1tCc3d1HGD2znVvmLil5,This Stupid World,This Stupid World,Yo La Tengo,02/10/2023,9/14/3125,34,frank.gibase,2023-02-22T17:23:20Z,"alternative rock,art pop,dream pop,indie rock,indietronica,lo-fi,new jersey indie,noise pop,permanent wave,shoegaze",0.291,0.496,2,-7.736,1,0.0398,0.0877,0.89,0.179,0.138,140.09,5,2023,2cdbrCxgycI5qXBykIRPKr
7zy2kNoeD72x2NEDaAsJOX,Psychedelic Switch,The Loveliest Time,Carly Rae Jepsen,07/28/2023,10/20/2644,55,frank.gibase,2023-07-31T19:54:26Z,"canadian pop,dance pop,pop",0.681,0.805,4,-6.676,1,0.048,0.00182,0.0158,0.341,0.304,127.907,4,2023,2cdbrCxgycI5qXBykIRPKr
1Fav4xZn60uGM3XmiHJmvT,One Of Your Girls,Something To Give Each Other,Troye Sivan,10/13/2023,181481,63,wes.herr,2024-12-16T14:56:10Z,"australian pop,pop,viral pop",0.635,0.648,11,-7.78,0,0.0548,0.101,0.00426,0.198,0.8,93,4,2024,2hxjD4HzA6KJ9IRvTMixfg
1k2pQc5i348DCHwbn5KTdc,Pink Pony Club,The Rise and Fall of a Midwest Princess,Chappell Roan,09/22/2023,258034,85,wes.herr,2024-12-17T16:14:29Z,indie pop,0.61,0.65,6,-6.199,1,0.0474,0.399,0,0.11,0.507,106.719,4,2024,2hxjD4HzA6KJ9IRvTMixfg
1kSWrMDt439cT64WpjJigW,19-2000,Gorillaz,Gorillaz,06/25/2001,210880,58,wes.herr,2024-12-12T18:48:25Z,"alternative hip hop,modern rock,rock",0.815,0.72,7,-7.311,1,0.0536,0.177,0.00000731,0.16,0.946,89.914,4,2024,2hxjD4HzA6KJ9IRvTMixfg
22folQ3QnjKJJbLio4clzr,Why Does My Heart Feel So Bad?,Play & Play: B Sides,Moby,06/02/2008,264826,31,wes.herr,2024-12-12T18:49:02Z,"downtempo,electronica",0.598,0.624,7,-6.923,1,0.0332,0.00108,0.0755,0.0826,0.0451,98.004,4,2024,2hxjD4HzA6KJ9IRvTMixfg
2Oidi4pAbR9X81PBaV71N8,One Night/All Night,Hyperdrama,Justice,04/26/2024,276066,61,wes.herr,2024-12-12T18:56:20Z,"alternative dance,dance-punk,electronica,filter house,indietronica,new rave,australian psych,modern rock,neo-psychedelic,rock",0.686,0.506,0,-9.352,0,0.179,0.03,0.0414,0.641,0.638,116.139,4,2024,2hxjD4HzA6KJ9IRvTMixfg
2RQ3fWFZJJe4G5KkHEACww,Pinch Me,Maroon,Barenaked Ladies,09/01/2000,285160,53,wes.herr,2024-12-12T18:54:10Z,"canadian pop,canadian rock,pop rock,post-grunge",0.68,0.857,7,-4.132,1,0.0373,0.0151,0.0000288,0.056,0.794,95.349,4,2024,2hxjD4HzA6KJ9IRvTMixfg
3adnLFXKO5rC1lhUNSeg3N,White Flag,Life For Rent,Dido,09/03/2003,240600,59,wes.herr,2024-12-16T16:27:18Z,"dance pop,europop,lilith,neo mellow,pop rock",0.509,0.538,5,-6.835,1,0.0379,0.306,0.00000503,0.091,0.284,170.111,4,2024,2hxjD4HzA6KJ9IRvTMixfg
3e7yziCpnpx2ujgvXqSLzp,Kingston Town,Labour Of Love II,UB40,01/01/1989,228293,50,wes.herr,2024-12-12T18:53:53Z,"reggae fusion,uk reggae",0.956,0.254,8,-13.264,1,0.0551,0.156,0.0362,0.0362,0.8,102.071,4,2024,2hxjD4HzA6KJ9IRvTMixfg
3mZ6PVxWBhCycZxeEJQDNs,State of Independence,Donna Summer,Donna Summer,07/19/1982,351493,44,wes.herr,2024-12-12T18:47:24Z,"disco,hi-nrg,new wave pop,soft rock",0.747,0.696,4,-8.696,1,0.177,0.182,0.0574,0.0616,0.875,169.502,4,2024,2hxjD4HzA6KJ9IRvTMixfg
3oDRri7iJCeKKNstpzbZqx,Cherry Blossom,Cherry Blossom,Empire Of The Sun,06/21/2024,207587,50,wes.herr,2024-12-12T18:55:50Z,"australian dance,australian electropop,dance rock,indietronica,neo-synthpop",0.64,0.843,5,-5.496,0,0.0597,0.00588,0.00000741,0.106,0.541,131.994,4,2024,2hxjD4HzA6KJ9IRvTMixfg
3qwQ6lgxH5VaU1Itv0yVpy,Damaged,Screamadelica,Primal Scream,09/23/1991,339426,19,wes.herr,2024-12-12T19:00:26Z,"alternative rock,britpop,dance rock,scottish indie",0.351,0.195,2,-16.208,1,0.0315,0.227,0.00000115,0.0914,0.385,153.679,4,2024,2hxjD4HzA6KJ9IRvTMixfg
3RlGLTcM9OwrAA0ErwJ2rA,The Moon Is Blue,Colourbox,Colourbox,08/12/1985,277093,36,wes.herr,2024-12-17T00:36:40Z,"deep new wave,new wave,uk post-punk",0.565,0.607,7,-10.514,1,0.0282,0.169,0.0000221,0.217,0.705,109.468,3,2024,2hxjD4HzA6KJ9IRvTMixfg
3zpjkbqo5eL2vPFX6qF1up,The Longest Kiss,The Longest Kiss,The Darkness,09/18/2024,169900,36,wes.herr,2024-12-12T18:53:37Z,"glam metal,hard rock",0.624,0.654,4,-4.335,1,0.0292,0.00652,0.0000373,0.265,0.732,89.001,4,2024,2hxjD4HzA6KJ9IRvTMixfg
4IsbtqsROVspyi7kzh3Vkx,Afterimage,Hyperdrama,Justice,04/26/2024,245560,54,wes.herr,2024-12-12T18:56:15Z,"alternative dance,dance-punk,electronica,filter house,indietronica,new rave,alternative r&b,dutch r&b",0.643,0.712,1,-9.192,1,0.0496,0.000237,0.714,0.548,0.736,111.991,4,2024,2hxjD4HzA6KJ9IRvTMixfg
4JwFrnLLSO4qqxOeHQATf4,Sunday Mornin' Comin' Down,Kristofferson,Kris Kristofferson,01/01/1970,270706,43,wes.herr,2024-12-12T18:52:57Z,"country,country rock,outlaw country,singer-songwriter",0.515,0.263,9,-15.13,1,0.0383,0.474,0.000138,0.111,0.519,78.904,4,2024,2hxjD4HzA6KJ9IRvTMixfg
4tKGFmENO69tZR9ahgZu48,Murder On The Dancefloor,Read My Lips (Deluxe Version),Sophie Ellis-Bextor,06/06/2002,230013,79,wes.herr,2024-12-16T14:55:57Z,"dance pop,europop,new wave pop",0.73,0.849,1,-5.281,0,0.0299,0.00234,0.0000257,0.312,0.887,117.308,4,2024,2hxjD4HzA6KJ9IRvTMixfg
4vh6Rn6FVG4w79JmlZ5p7d,Got To Keep On,No Geography,The Chemical Brothers,04/12/2019,316680,49,wes.herr,2024-12-12T18:48:42Z,"alternative dance,big beat,breakbeat,electronica,rave,trip hop",0.721,0.867,6,-6.209,0,0.0528,0.048,0.125,0.0828,0.917,125.005,4,2024,2hxjD4HzA6KJ9IRvTMixfg
4zI0wuANmj9DNkBOgXU5Wh,Two Months Off,A Hundred Days Off,Underworld,08/28/2002,548560,42,wes.herr,2024-12-12T18:48:01Z,"big beat,electronica",0.582,0.896,10,-9.152,0,0.0638,0.00211,0.728,0.0218,0.665,134.994,4,2024,2hxjD4HzA6KJ9IRvTMixfg
55p5aqdMdND6fGRqoxqtTt,Soccer Moms,Liquid Treasure,Philiptheartist,08/08/2024,276978,31,wes.herr,2024-12-12T18:51:05Z,,0.683,0.646,9,-8.965,1,0.0413,0.0368,0.0413,0.0684,0.911,96.025,4,2024,2hxjD4HzA6KJ9IRvTMixfg
59qXaQkS6Z6Ci3o5pajjob,Honey,Play: The Complete Recordings,Moby,05/17/1999,209493,45,wes.herr,2024-12-16T17:02:29Z,"downtempo,electronica",0.824,0.693,8,-8.574,1,0.033,0.13,0.224,0.0672,0.76,102.11,4,2024,2hxjD4HzA6KJ9IRvTMixfg
5Bno6wFa22tRbFUwh4iZdk,Bought The Earth,2093,Yeat,02/16/2024,178285,50,wes.herr,2024-12-16T14:58:00Z,"pluggnb,rage rap",0.337,0.373,5,-11.967,0,0.0464,0.0531,0.103,0.334,0.0943,140.284,4,2024,2hxjD4HzA6KJ9IRvTMixfg
5P4qN0020P8dGyl7pdUO91,Our Lives Are Shaped By What We Love,Odyssey,Odyssey,09/28/1972,217466,36,wes.herr,2024-12-17T00:38:53Z,,0.542,0.805,4,-7.332,0,0.0339,0.249,0.000246,0.231,0.844,96.402,4,2024,2hxjD4HzA6KJ9IRvTMixfg
6dBUzqjtbnIa1TwYbyw5CM,Lovers Rock,French Exit,TV Girl,06/05/2014,213920,85,wes.herr,2024-12-17T00:40:28Z,pov: indie,0.559,0.871,5,-5.338,0,0.0397,0.00000753,0.00545,0.096,0.572,104.97,4,2024,2hxjD4HzA6KJ9IRvTMixfg
6eozUVzr02EXMji1vuxgiP,Don't Wanna Fall in Love,Jane Child,Jane Child,01/19/1990,247840,50,wes.herr,2024-12-12T18:57:00Z,new wave pop,0.708,0.681,1,-11.226,1,0.0422,0.0152,0.0000343,0.0373,0.814,111.574,4,2024,2hxjD4HzA6KJ9IRvTMixfg
6PNvv1dmDbOWrAYwEcuKBX,Criminal,Tidal,Fiona Apple,07/23/1996,341533,62,wes.herr,2024-12-17T00:35:23Z,"art pop,chamber pop,dark pop,lilith,permanent wave,piano rock,singer-songwriter",0.595,0.804,7,-7.911,0,0.0326,0.0129,0.0000197,0.299,0.586,89.846,4,2024,2hxjD4HzA6KJ9IRvTMixfg
6r9GzPEdq4bGp507oxt2iZ,Lost In Space,Paradise State of Mind,Foster The People,08/16/2024,259252,49,wes.herr,2024-12-17T15:51:59Z,"indietronica,modern alternative rock,modern rock,rock",0.818,0.794,5,-4.606,0,0.0416,0.019,0.0615,0.0741,0.737,122.428,4,2024,2hxjD4HzA6KJ9IRvTMixfg
6VWFrHAnLDyNUEJbJvpkZA,Are You Jimmy Ray?,Jimmy Ray,Jimmy Ray,03/10/1998,201200,35,wes.herr,2024-12-12T18:54:23Z,,0.75,0.914,10,-5.707,0,0.0704,0.13,0.0000233,0.392,0.673,99.083,4,2024,2hxjD4HzA6KJ9IRvTMixfg
7dSBZzVmyBaLDxT2v3EJHB,Loaded,Screamadelica,Primal Scream,09/23/1991,422600,37,wes.herr,2024-12-12T19:00:17Z,"alternative rock,britpop,dance rock,scottish indie",0.624,0.54,8,-14.741,1,0.0524,0.000085,0.63,0.84,0.872,91.15,4,2024,2hxjD4HzA6KJ9IRvTMixfg
7lvOrwqOV3N63ZQPpl5seo,Nice Mover,Nice Mover,Gina X Performance,01/01/1978,274120,40,wes.herr,2024-12-19T01:24:08Z,"dance rock,early synthpop,synthpop",0.518,0.537,6,-12.439,0,0.0282,0.00137,0.00074,0.371,0.579,81.057,4,2024,2hxjD4HzA6KJ9IRvTMixfg
7xQYVjs4wZNdCwO0EeAWMC,Born Slippy (Nuxx),1992 - 2012,Underworld,01/01/2014,456480,64,wes.herr,2024-12-12T18:47:43Z,"big beat,electronica",0.576,0.953,10,-8.968,1,0.0362,0.00106,0.49,0.474,0.303,140.042,4,2024,2hxjD4HzA6KJ9IRvTMixfg
0At2qAoaVjIwWNAqrscXli,Boo'd Up,READY,Ella Mai,02/22/2017,256063,68,anna.hoffman,2018-12-19T16:22:56Z,r&b,0.561,0.779,10,-5.107,0,0.0531,0.0862,0,0.078,0.235,81.965,4,2018 Tops,7CbFtd61fiayo7rKQwiD4r
0CZ8lquoTX2Dkg7Ak2inwA,1950,1950,King Princess,02/23/2018,225133,64,anna.hoffman,2018-12-19T16:31:25Z,,0.6,0.535,4,-7.043,1,0.107,0.648,0.0000047,0.162,0.269,71.912,4,2018 Tops,7CbFtd61fiayo7rKQwiD4r
0JP9xo3adEtGSdUEISiszL,Moonlight,?,XXXTENTACION,03/16/2018,135090,82,anna.hoffman,2018-12-20T23:00:53Z,emo rap,0.921,0.537,9,-5.723,0,0.0804,0.556,0.00404,0.102,0.711,128.009,4,2018 Tops,7CbFtd61fiayo7rKQwiD4r
17JYzDCW1UTndfURuTydF2,Dance To This (feat. Ariana Grande),Bloom,Troye Sivan;Ariana Grande,08/31/2018,231846,0,anna.hoffman,2018-12-20T22:40:22Z,pop,0.736,0.756,11,-7.099,1,0.047,0.00632,0.00577,0.106,0.712,117.016,4,2018 Tops,7CbFtd61fiayo7rKQwiD4r
1bb9eogTs9f8FrxlQ8Rvr2,Punches (with LP),Good Cry,Noah Cyrus;LP,09/21/2018,253240,41,anna.hoffman,2018-12-21T18:40:17Z,,0.531,0.499,0,-8.793,1,0.0403,0.416,0,0.131,0.182,118.059,4,2018 Tops,7CbFtd61fiayo7rKQwiD4r
29KlmabUzYbnhSXEqP1ZDd,Where Have You Been?,Good Cry,Noah Cyrus,09/21/2018,158506,21,anna.hoffman,2018-12-19T16:23:57Z,,0.444,0.311,3,-13.047,1,0.0438,0.815,0.0019,0.125,0.285,124.014,4,2018 Tops,7CbFtd61fiayo7rKQwiD4r
2Cu5ExXidcoE4vF5hIYict,Heart to Break,Heart to Break,Kim Petras,02/14/2018,225972,0,anna.hoffman,2018-12-19T16:29:16Z,,0.74,0.631,11,-4.865,1,0.196,0.0403,0.00000277,0.253,0.887,109.029,4,2018 Tops,7CbFtd61fiayo7rKQwiD4r
2mj7x99sNUsVHPBRK51zlG,Electric (feat. Khalid),The Color Of You,Alina Baraz;Khalid,04/06/2018,246327,2,anna.hoffman,2018-12-19T16:25:47Z,,0.599,0.396,10,-10.489,0,0.0392,0.738,0.0000219,0.102,0.134,111.072,4,2018 Tops,7CbFtd61fiayo7rKQwiD4r
2Tl0t18jgqJo0S7Fs2iy50,Body Language - Intro,Isolation,Kali Uchis,04/06/2018,136342,51,anna.hoffman,2018-12-19T16:23:43Z,,0.387,0.706,9,-8.74,1,0.128,0.639,0.00404,0.285,0.588,115.956,4,2018 Tops,7CbFtd61fiayo7rKQwiD4r
2U2Z1IXnmJIvlknWizFykZ,High Horse,Golden Hour,Kacey Musgraves,03/30/2018,213693,60,anna.hoffman,2018-12-20T22:38:42Z,,0.725,0.674,11,-5.254,0,0.0363,0.0325,0.00000355,0.0531,0.773,120.057,4,2018 Tops,7CbFtd61fiayo7rKQwiD4r
2xWVD6aecDSHroyPVVcPpa,Love Me Right,Conexão - EP,Amber Mark,05/04/2018,291900,46,anna.hoffman,2018-12-20T21:48:51Z,"alternative r&b,indie soul",0.53,0.525,5,-6.767,0,0.0522,0.0842,0.0000211,0.109,0.231,179.944,4,2018 Tops,7CbFtd61fiayo7rKQwiD4r
33zcmmElV1YbRZe57biUjg,Celoso,Celoso,Lele Pons,08/17/2018,179693,69,anna.hoffman,2018-12-20T21:54:26Z,,0.746,0.703,4,-4.179,0,0.107,0.352,0,0.331,0.667,166.044,4,2018 Tops,7CbFtd61fiayo7rKQwiD4r
39N9RPD9MRb5WmoLzNzPeA,X,X,Nicky Jam;J Balvin,03/02/2018,173627,2,anna.hoffman,2018-12-20T21:53:32Z,"reggaeton,latin",0.595,0.773,9,-4.736,0,0.0549,0.0364,0.00108,0.334,0.711,180.073,4,2018 Tops,7CbFtd61fiayo7rKQwiD4r
3l1QX9fhldeI23AlON5iY3,Cold War,Blood Type,Cautious Clay,02/21/2018,203317,0,anna.hoffman,2018-12-20T21:49:12Z,,0.636,0.556,6,-8.994,0,0.0539,0.194,0.137,0.1,0.363,77.108,4,2018 Tops,7CbFtd61fiayo7rKQwiD4r
45Egmo7icyopuzJN0oMEdk,Love Lies,Love Lies,Khalid;Normani,02/14/2018,201707,73,anna.hoffman,2018-12-20T21:31:43Z,,0.708,0.648,6,-5.626,1,0.0449,0.0956,0,0.134,0.338,143.955,4,2018 Tops,7CbFtd61fiayo7rKQwiD4r
4eWQlBRaTjPPUlzacqEeoQ,Never Be the Same,Camila,Camila Cabello,01/12/2018,226973,78,anna.hoffman,2018-12-20T23:02:43Z,,0.637,0.713,0,-4.333,1,0.0747,0.181,0.000637,0.137,0.243,129.923,4,2018 Tops,7CbFtd61fiayo7rKQwiD4r
4uf9vttaZb5rehtxzrL4Dx,What She Wants,COLD NIGHTS // SUMMER DAYS,A R I Z O N A,08/03/2018,205100,42,anna.hoffman,2018-12-19T16:28:48Z,,0.715,0.656,5,-6.154,1,0.0259,0.0162,0.000501,0.0882,0.423,126.01,4,2018 Tops,7CbFtd61fiayo7rKQwiD4r
56RfNBJGUgL1ZFCB1KEJrQ,Django Jane,Dirty Computer,Janelle Monáe,04/27/2018,190288,41,anna.hoffman,2018-12-19T16:25:10Z,alternative r&b,0.833,0.624,11,-6.306,1,0.325,0.49,0,0.117,0.26,101.96,4,2018 Tops,7CbFtd61fiayo7rKQwiD4r
5btaVjrLBxTvXNmCv5DrW2,Curious,Expectations,Hayley Kiyoko,03/30/2018,183280,47,anna.hoffman,2018-12-20T22:40:02Z,,0.788,0.703,1,-5.986,0,0.127,0.0753,0.0000613,0.333,0.442,104.049,4,2018 Tops,7CbFtd61fiayo7rKQwiD4r
5gW5dSy3vXJxgzma4rQuzH,Make Me Feel,Dirty Computer,Janelle Monáe,04/27/2018,194230,58,anna.hoffman,2018-12-19T16:24:47Z,alternative r&b,0.859,0.413,1,-7.399,1,0.182,0.132,0,0.334,0.697,115.035,4,2018 Tops,7CbFtd61fiayo7rKQwiD4r
5NfcEDtSmpDsexYSw9EMza,Mad at You (with Gallant),Good Cry,Noah Cyrus;Gallant,09/21/2018,226213,22,anna.hoffman,2018-12-21T18:40:11Z,alternative r&b,0.568,0.421,5,-4.324,0,0.0278,0.809,0,0.156,0.506,95.959,1,2018 Tops,7CbFtd61fiayo7rKQwiD4r
5oJAaPRS2EzNIc8EWIbucE,Miami (feat. BIA),Isolation,Kali Uchis;BIA,04/06/2018,243864,52,anna.hoffman,2018-12-21T18:18:05Z,,0.624,0.785,11,-5.634,0,0.034,0.00382,0,0.0883,0.656,95.933,4,2018 Tops,7CbFtd61fiayo7rKQwiD4r
5qHirGR7M9tdm6C17DlzSY,REEL IT IN,ONEPOINTFIVE,Aminé,08/15/2018,121346,65,anna.hoffman,2018-12-20T21:36:46Z,,0.754,0.342,10,-8.677,0,0.0991,0.073,0,0.193,0.423,128.981,4,2018 Tops,7CbFtd61fiayo7rKQwiD4r
5RBW30fFFVav2n0IqFj0fY,Olha A Explosão - Remix,Olha A Explosão (Remix),MC Kevinho;2 Chainz;French Montana;Nacho,04/27/2018,210773,46,anna.hoffman,2018-12-21T18:11:59Z,"brazilian funk,funk pop,rap,southern hip hop,reggaeton,latin",0.759,0.644,6,-4.858,1,0.116,0.326,0,0.0469,0.813,89.983,4,2018 Tops,7CbFtd61fiayo7rKQwiD4r
5SrxVnCEghPsAplJEPCHL2,All the Time,All the Time,Kim Petras,08/24/2018,195313,0,anna.hoffman,2018-12-19T16:32:48Z,,0.477,0.778,5,-4.166,1,0.133,0.0111,0.0000883,0.198,0.758,129.42,3,2018 Tops,7CbFtd61fiayo7rKQwiD4r
6QDi3G7ng3vWiIXQJntQSZ,F*** Being Friends,Being Human In Public,Jessie Reyez,10/19/2018,151226,46,anna.hoffman,2018-12-19T16:23:47Z,,0.892,0.519,1,-5.841,0,0.0923,0.0611,0.0000395,0.0556,0.352,78.022,4,2018 Tops,7CbFtd61fiayo7rKQwiD4r
6R4fwYApPpBROATC6gLl10,Sadness,Good Cry,Noah Cyrus,09/21/2018,161680,32,anna.hoffman,2018-12-21T18:40:25Z,,0.687,0.381,1,-10.552,0,0.0403,0.405,0,0.102,0.24,114.982,4,2018 Tops,7CbFtd61fiayo7rKQwiD4r
6vsV4D8BM6PioRr1UOx0n2,you should see me in a crown,you should see me in a crown,Billie Eilish,07/18/2018,180566,0,anna.hoffman,2018-12-21T20:55:24Z,,0.697,0.552,1,-10.271,0,0.196,0.479,0.127,0.147,0.278,75.235,4,2018 Tops,7CbFtd61fiayo7rKQwiD4r
7DrluKkTviBwCc8AV3VGmf,Clandestino,Clandestino,Shakira;Maluma,06/08/2018,231920,70,anna.hoffman,2018-12-21T18:11:26Z,"latin pop,reggaeton,latin,urbano latino",0.766,0.822,1,-4.126,0,0.16,0.39,0.0000337,0.349,0.881,165.842,4,2018 Tops,7CbFtd61fiayo7rKQwiD4r
7ef4DlsgrMEH11cDZd32M6,One Kiss (with Dua Lipa),One Kiss (with Dua Lipa),Calvin Harris;Dua Lipa,04/06/2018,214846,79,anna.hoffman,2018-12-20T21:32:36Z,"edm,pop",0.791,0.862,9,-3.24,0,0.11,0.037,0.0000219,0.0814,0.592,123.994,4,2018 Tops,7CbFtd61fiayo7rKQwiD4r
0bGH7ezs7WdDwpqnsvGf1z,Purple Hat,Purple Hat,Sofi Tukker,09/06/2019,178369,4,sam.sin,2019-12-19T00:31:50Z,,0.777,0.744,9,-7.42,1,0.204,0.331,0.0073,0.088,0.654,94.019,4,2019 Top 30 Songs,3WYi7T6kXrNs8ECYbNb5v8
0wDY1kLqxEShKGxOs378Fu,Only Human,Only Human,KH;Four Tet,01/01/2019,201267,28,sam.sin,2019-12-18T15:22:35Z,"idm,electronica",0.824,0.642,8,-7.436,0,0.177,0.00184,0.000245,0.463,0.435,126.986,4,2019 Top 30 Songs,3WYi7T6kXrNs8ECYbNb5v8
11uFqlWnAlFMeQmjHKY38X,Teenage Birdsong,Teenage Birdsong,Four Tet,04/17/2019,205421,27,sam.sin,2019-12-18T15:22:45Z,"idm,electronica",0.633,0.866,7,-7.166,1,0.0558,0.475,0.723,0.0955,0.0625,195.986,4,2019 Top 30 Songs,3WYi7T6kXrNs8ECYbNb5v8
1j49Jcm99RNCmFrnRZgliG,Land Of Honey,Flamagra,Flying Lotus;Solange,05/24/2019,207994,0,sam.sin,2019-12-18T20:18:24Z,"idm,experimental hip hop,nu jazz,glitch,alternative r&b,neo soul",0.368,0.619,9,-6.633,0,0.0308,0.0619,0.0476,0.145,0.0878,88.033,4,2019 Top 30 Songs,3WYi7T6kXrNs8ECYbNb5v8
1SaK0McbvuAUq9EavN80p0,Koto - Koto Lazy Syrup Orchestra & Waspy [Remix],Koto,CloZee;Lazy Syrup Orchestra;Waspy,06/14/2019,248888,0,sam.sin,2019-12-19T00:35:36Z,,0.679,0.733,2,-7.587,1,0.0274,0.00851,0.934,0.183,0.253,107.988,4,2019 Top 30 Songs,3WYi7T6kXrNs8ECYbNb5v8
2em49KG5AHF0QLnneDEHlW,Dancin',Redux 003,Kaskade;LöKii,05/10/2019,216851,0,sam.sin,2019-12-18T20:18:36Z,edm,0.758,0.716,5,-6.414,1,0.0396,0.00032,0.824,0.0817,0.604,118.013,4,2019 Top 30 Songs,3WYi7T6kXrNs8ECYbNb5v8
2UsqfOoYCDm9tB3JB0nFCY,I C Light,Langata,Crooked Colours,05/17/2019,180420,38,sam.sin,2019-12-19T00:21:16Z,,0.684,0.711,5,-8.288,1,0.0608,0.0703,0.000548,0.253,0.458,147.974,4,2019 Top 30 Songs,3WYi7T6kXrNs8ECYbNb5v8
2YegRTu9IjiUg4VWfnXyM3,Sympathy,Father of the Bride,Vampire Weekend,05/03/2019,226733,38,sam.sin,2019-12-18T15:23:12Z,"indie,baroque pop",0.708,0.777,11,-5.507,0,0.0568,0.0199,0.0023,0.193,0.661,119.968,4,2019 Top 30 Songs,3WYi7T6kXrNs8ECYbNb5v8
3PURbsY67tLMyausOABtit,Feel Good,Kingdoms In Colour,Maribou State;Khruangbin,09/07/2018,267200,55,sam.sin,2019-12-19T00:33:53Z,neo-psychedelic,0.567,0.757,4,-8.371,0,0.0354,0.328,0.826,0.356,0.403,102.016,4,2019 Top 30 Songs,3WYi7T6kXrNs8ECYbNb5v8
3XiNC94b4Tq1xwv70sQJGN,Sanguine Paradise,Sanguine Paradise,Lil Uzi Vert,04/09/2019,243976,70,sam.sin,2019-12-18T21:18:19Z,melodic rap,0.729,0.603,6,-6.736,0,0.0666,0.0948,0,0.113,0.207,134.972,4,2019 Top 30 Songs,3WYi7T6kXrNs8ECYbNb5v8
3Xuhi20r1A2FGQHAisL551,Voices,Hi This Is Flume (Mixtape),Flume;SOPHIE;KUČKA,03/22/2019,114645,0,sam.sin,2019-12-18T15:25:18Z,"future bass,hyperpop,art pop,experimental",0.567,0.758,9,-3.998,1,0.095,0.0937,0.00249,0.601,0.242,133.687,4,2019 Top 30 Songs,3WYi7T6kXrNs8ECYbNb5v8
4DAaQ5InUO23d8yNRbB0Yj,6's to 9's,Superdream,Big Wild;Rationale,02/01/2019,206073,62,sam.sin,2019-12-18T15:28:23Z,,0.714,0.663,8,-5.799,1,0.0694,0.145,0,0.264,0.64,95.497,4,2019 Top 30 Songs,3WYi7T6kXrNs8ECYbNb5v8
4rk8JQfk4ZiVBR8e7dbyYn,My Friends and I Pt. 2,Ride Waves,GRiZ;Snoop Dogg;ProbCause,04/05/2019,231632,0,sam.sin,2019-12-18T21:38:26Z,"dubstep,g-funk,west coast hip hop,gangster rap,hip hop,old school hip hop,rap",0.757,0.835,7,-6.356,1,0.0467,0.000551,0.000168,0.139,0.756,139.988,4,2019 Top 30 Songs,3WYi7T6kXrNs8ECYbNb5v8
4u8xrKWeF7xBO9kGwIk6u7,Proud Of U (feat. Young Thug),Mirrorland,EARTHGANG;Young Thug,09/06/2019,238200,46,sam.sin,2019-12-18T15:25:40Z,"rap,melodic rap,trap",0.768,0.456,2,-8.676,1,0.354,0.0691,0,0.162,0.39,77.582,4,2019 Top 30 Songs,3WYi7T6kXrNs8ECYbNb5v8
4woZVSTgV0Bysat3lsTBWe,Bhangra Saanj,"SCI Sound Lab, Bhangra Saanj - Single",The String Cheese Incident;Beats Antique,02/15/2019,296650,30,sam.sin,2019-12-18T20:15:30Z,"newgrass,jam band,bluegrass",0.638,0.731,5,-5.84,0,0.048,0.0122,0.859,0.362,0.44,93.022,4,2019 Top 30 Songs,3WYi7T6kXrNs8ECYbNb5v8
4yU34EpDH9ccGoKS6oamoV,hyperfunkk,CLASS XIX,pluko,05/31/2019,227796,22,sam.sin,2019-12-18T15:27:16Z,"stutter house,future bass",0.879,0.616,4,-6.515,0,0.129,0.337,0.0208,0.0999,0.41,118.031,4,2019 Top 30 Songs,3WYi7T6kXrNs8ECYbNb5v8
51fG8o0BHEcX3pWidaP2tM,What You Need,All for Money,Greensky Bluegrass,01/18/2019,409974,31,sam.sin,2019-12-19T00:38:32Z,"newgrass,bluegrass,americana",0.549,0.525,9,-12.141,1,0.0291,0.323,0.245,0.421,0.533,104.049,4,2019 Top 30 Songs,3WYi7T6kXrNs8ECYbNb5v8
53KFMdxzi8IJDewiql1Qo3,Sunflower (feat. Steve Lacy),Father of the Bride,Vampire Weekend;Steve Lacy,05/03/2019,137600,51,sam.sin,2019-12-18T15:23:14Z,"indie,baroque pop",0.863,0.576,8,-5.691,1,0.0567,0.406,0.00824,0.141,0.932,100.03,4,2019 Top 30 Songs,3WYi7T6kXrNs8ECYbNb5v8
5hVghJ4KaYES3BFUATCYn0,EARFQUAKE,IGOR,Tyler The Creator,05/17/2019,190066,78,sam.sin,2019-12-18T20:15:04Z,,0.554,0.498,9,-8.866,1,0.0685,0.23,0.00000598,0.795,0.413,79.635,4,2019 Top 30 Songs,3WYi7T6kXrNs8ECYbNb5v8
5KBARWIxeMGkvUax9VtVC9,My Type,ICY,Saweetie,03/29/2019,126446,70,sam.sin,2019-12-18T21:17:19Z,,0.899,0.811,2,-6.294,1,0.258,0.000677,0,0.0672,0.587,105.038,4,2019 Top 30 Songs,3WYi7T6kXrNs8ECYbNb5v8
5tjqfi2tLQONdHxnR4SdcO,Easy,Easy,Tycho,04/17/2019,207001,0,sam.sin,2019-12-19T00:34:20Z,"chillwave,downtempo,idm",0.612,0.629,5,-15.219,0,0.0355,0.339,0.946,0.153,0.208,120.061,4,2019 Top 30 Songs,3WYi7T6kXrNs8ECYbNb5v8
5wCVLW9qMtIY9IkBeyYnh6,When Am I Gonna Lose You,Violet Street,Local Natives,04/26/2019,264213,57,sam.sin,2019-12-18T15:27:40Z,,0.452,0.834,11,-4.657,1,0.0967,0.0417,0.00036,0.119,0.514,142.088,4,2019 Top 30 Songs,3WYi7T6kXrNs8ECYbNb5v8
694vvR5o19xHPhhJ5QdLN7,NO HALO,GINGER,BROCKHAMPTON,08/23/2019,259746,52,sam.sin,2019-12-19T00:39:15Z,,0.643,0.573,4,-7.034,1,0.0709,0.41,0.00017,0.0695,0.47,165.192,4,2019 Top 30 Songs,3WYi7T6kXrNs8ECYbNb5v8
6gKmuFhqEYmHf7ojbanTEg,Walls Down,Walls Down,MEMBA;EVAN GIIA,05/08/2019,192905,0,sam.sin,2019-12-18T15:27:10Z,future bass,0.673,0.781,10,-5.34,0,0.265,0.261,0.000383,0.557,0.534,133.972,4,2019 Top 30 Songs,3WYi7T6kXrNs8ECYbNb5v8
6Ozh9Ok6h4Oi1wUSLtBseN,BOP,KIRK,DaBaby,09/27/2019,159714,73,sam.sin,2019-12-18T20:16:29Z,,0.769,0.787,11,-3.909,1,0.367,0.189,0,0.129,0.836,126.77,4,2019 Top 30 Songs,3WYi7T6kXrNs8ECYbNb5v8
75XkVxxfzftR2z1UQrR8sC,Schools Out,SAGA-II,MEMBA,08/16/2019,175072,0,sam.sin,2019-12-19T00:41:51Z,future bass,0.602,0.615,10,-5.868,1,0.0373,0.0966,0.81,0.1,0.245,178.069,4,2019 Top 30 Songs,3WYi7T6kXrNs8ECYbNb5v8
7BdBAeVMiVHbszGoN7WsAt,Memories That You Call - ODESZA & Golden Features VIP Remix,A Moment Apart (Deluxe Edition),ODESZA;Monsoonsiren;Golden Features,11/30/2018,219506,48,sam.sin,2019-12-18T15:26:16Z,"chillwave,chillstep",0.635,0.576,10,-4.624,1,0.0314,0.0116,0.836,0.121,0.188,119.997,4,2019 Top 30 Songs,3WYi7T6kXrNs8ECYbNb5v8
7c7ClnE57SwbizNe24XTXe,City of Sound,Superdream,Big Wild,02/01/2019,232000,48,sam.sin,2019-12-18T21:38:06Z,,0.684,0.482,7,-5.339,1,0.0346,0.0128,0.742,0.17,0.724,120.008,4,2019 Top 30 Songs,3WYi7T6kXrNs8ECYbNb5v8
7fNZGRpHftZ1j5pnfFRxAV,Kape Fear,The Omnitone Collection,Elder Island,02/08/2019,251494,46,sam.sin,2019-12-19T00:36:21Z,,0.743,0.602,8,-9.536,0,0.0392,0.217,0.652,0.348,0.283,108.027,4,2019 Top 30 Songs,3WYi7T6kXrNs8ECYbNb5v8
7xBIMcpUm5U14B2MKMoWOv,Places We Don’t Know - ford. Remix,Places We Don’t Know (ford. Remix),Kasbo;ford.,03/25/2019,202944,30,sam.sin,2019-12-18T21:37:05Z,future bass,0.664,0.6,1,-8.936,1,0.0469,0.646,0.559,0.0788,0.304,97.01,4,2019 Top 30 Songs,3WYi7T6kXrNs8ECYbNb5v8
0J8x2FryJyw7OVnEGYNFQE,Slow Dances,Slow Dances,Winnetka Bowling League,04/03/2019,232280,50,greg.miller,2020-12-04T19:49:07Z,,0.595,0.77,11,-5.392,1,0.0359,0.0129,0.00254,0.152,0.755,133.961,4,2020 Songs,5Hqh5VPCQtJkDEfc8L1EAi
0jAlxwXcjKNaFKoOiBCdiW,Starjumper,Mystic Truth,Bad Suns,03/22/2019,242573,27,greg.miller,2020-12-04T19:48:48Z,,0.307,0.451,10,-7.094,0,0.0329,0.0389,0.0000287,0.228,0.0796,109.154,4,2020 Songs,5Hqh5VPCQtJkDEfc8L1EAi
0U3u0HdRQjD8mAMYBak4Ok,Saw You In A Dream,Saw You In A Dream,The Japanese House,06/30/2017,208280,57,greg.miller,2020-12-04T19:55:07Z,,0.607,0.451,4,-8.206,1,0.0286,0.0604,0,0.19,0.676,94.054,4,2020 Songs,5Hqh5VPCQtJkDEfc8L1EAi
18Hq4xHyecxySkoUPQyYV2,Fire,Black Pumas,Black Pumas,06/21/2019,246120,0,greg.miller,2020-12-04T19:54:48Z,retro soul,0.713,0.838,9,-7.872,0,0.0549,0.0863,0.00653,0.349,0.842,95.963,4,2020 Songs,5Hqh5VPCQtJkDEfc8L1EAi
1e2LGT07diSwc7UYnK7txi,More Of The Same,LONER,Caroline Rose,02/23/2018,248791,0,greg.miller,2020-12-04T19:49:39Z,indie pop,0.731,0.764,7,-4.5,1,0.028,0.0824,0.00000395,0.0725,0.638,98.01,4,2020 Songs,5Hqh5VPCQtJkDEfc8L1EAi
1J5rHMEvQFpM07iLULi48A,back again,come out. you're hiding (deluxe),flor,02/02/2018,201398,41,greg.miller,2020-12-04T20:00:20Z,,0.636,0.597,8,-6.884,0,0.0279,0.118,0.00283,0.124,0.639,84.979,4,2020 Songs,5Hqh5VPCQtJkDEfc8L1EAi
23OXdR7YuUBVWh5hSnYJau,Chlorine,Trench,Twenty One Pilots,10/05/2018,324466,76,greg.miller,2020-12-14T19:32:18Z,,0.609,0.674,10,-7.388,0,0.0548,0.0735,0.06,0.345,0.315,90.009,4,2020 Songs,5Hqh5VPCQtJkDEfc8L1EAi
27ycaQnQAxaPiyeg3nr2aB,Midnight Sky,Midnight Sky,Miley Cyrus,08/14/2020,223279,3,greg.miller,2020-12-16T01:48:09Z,,0.705,0.814,4,-5.466,0,0.0346,0.00115,0.00312,0.203,0.259,110,4,2020 Songs,5Hqh5VPCQtJkDEfc8L1EAi
2FLW1FnWZxGUuiDgsLDGOG,Runner,Swimmer,Tennis,02/14/2020,216960,42,greg.miller,2020-12-04T20:07:31Z,,0.527,0.827,7,-6.083,1,0.0392,0.0817,0.00344,0.126,0.704,157.3,4,2020 Songs,5Hqh5VPCQtJkDEfc8L1EAi
2HS3rFy98oTpEWLVrwEXdk,Salted Caramel,Salted Caramel,Andrew Applepie,03/01/2019,206509,21,greg.miller,2020-12-12T18:31:23Z,,0.77,0.51,7,-7.997,0,0.142,0.412,0.0672,0.0607,0.907,164.043,4,2020 Songs,5Hqh5VPCQtJkDEfc8L1EAi
2pVvB487ZwqdzTxEvEEors,walking in the snow,RTJ4,Run The Jewels;El-P;Killer Mike,06/03/2020,235866,0,greg.miller,2020-12-04T19:51:07Z,"hip hop,experimental hip hop,southern hip hop,alternative hip hop",0.726,0.818,0,-6.473,1,0.311,0.0602,0,0.276,0.305,146.006,4,2020 Songs,5Hqh5VPCQtJkDEfc8L1EAi
2UbuXuTdSC0oR0upCbiLx2,Pick U Up,Pick U Up,Foster The People,09/06/2019,182440,45,greg.miller,2020-12-12T17:50:17Z,,0.812,0.816,2,-4.478,1,0.0448,0.0316,0.0000363,0.153,0.88,110.965,4,2020 Songs,5Hqh5VPCQtJkDEfc8L1EAi
3iEqGBZ2wcpVzhiAcwXVC6,If You’re Too Shy (Let Me Know) - Edit,If You’re Too Shy (Let Me Know),The 1975,04/23/2020,239876,48,greg.miller,2020-12-04T20:47:54Z,,0.651,0.806,2,-4.842,1,0.0311,0.00399,0.00455,0.0927,0.386,125.641,4,2020 Songs,5Hqh5VPCQtJkDEfc8L1EAi
3Pqy5RRW33bhxYXN0ZZNXG,Confirmation (SSBD),Your Hero Is Not Dead,Westerman,06/05/2020,258266,0,greg.miller,2020-12-12T18:16:43Z,,0.778,0.465,8,-8.637,1,0.0328,0.803,0.169,0.105,0.477,121.962,4,2020 Songs,5Hqh5VPCQtJkDEfc8L1EAi
4nGQ1teaW9xVxULp7qpd4l,Working Out,The Don,Donny Benét,04/06/2018,291167,0,greg.miller,2020-12-04T20:08:50Z,post-disco,0.862,0.666,2,-7.234,1,0.0539,0.00417,0.296,0.0436,0.976,132.067,4,2020 Songs,5Hqh5VPCQtJkDEfc8L1EAi
4nK5YrxbMGZstTLbvj6Gxw,Supalonely,STELLA & STEVE,BENEE;Gus Dapperton,11/15/2019,223480,65,greg.miller,2020-12-04T19:48:30Z,bedroom pop,0.863,0.63,7,-4.688,1,0.0537,0.304,0.0000304,0.123,0.816,128.977,4,2020 Songs,5Hqh5VPCQtJkDEfc8L1EAi
5hM5arv9KDbCHS0k9uqwjr,Borderline,The Slow Rush,Tame Impala,02/14/2020,237800,84,greg.miller,2020-12-16T01:47:54Z,"neo-psychedelic,indie",0.621,0.873,5,-3.067,0,0.0369,0.0406,0.0000091,0.0824,0.873,97.96,4,2020 Songs,5Hqh5VPCQtJkDEfc8L1EAi
5taqLrLouA4vCjM7ZQpEtW,ooh la la (feat. Greg Nice & DJ Premier),RTJ4,Run The Jewels;El-P;Killer Mike;Greg Nice;DJ Premier,06/03/2020,183826,1,greg.miller,2020-12-04T19:51:04Z,"hip hop,experimental hip hop,southern hip hop,alternative hip hop,east coast hip hop",0.686,0.824,11,-5.413,1,0.34,0.157,0,0.242,0.405,170.079,4,2020 Songs,5Hqh5VPCQtJkDEfc8L1EAi
5wCVLW9qMtIY9IkBeyYnh6,When Am I Gonna Lose You,Violet Street,Local Natives,04/26/2019,264213,57,greg.miller,2020-12-12T18:12:13Z,,0.452,0.834,11,-4.657,1,0.0967,0.0417,0.00036,0.119,0.514,142.088,4,2020 Songs,5Hqh5VPCQtJkDEfc8L1EAi
5ZvHcR4OSwvEV5IhigbTOT,Underwater,SOLACE,RÜFÜS DU SOL,10/19/2018,349293,65,greg.miller,2020-12-04T19:48:51Z,,0.611,0.809,6,-6.63,0,0.0342,0.019,0.0185,0.114,0.428,118.003,4,2020 Songs,5Hqh5VPCQtJkDEfc8L1EAi
61GiMDN1kUiEQK6zHGMdnx,Metamodernity,Metamodernity,Vansire,06/11/2019,162663,0,greg.miller,2020-12-12T18:14:08Z,bedroom pop,0.822,0.544,5,-10.077,1,0.0358,0.389,0.165,0.108,0.826,121.968,4,2020 Songs,5Hqh5VPCQtJkDEfc8L1EAi
68vxG1i6RSmrsY9mRdqDgG,Burning,Heard It In A Past Life,Maggie Rogers,01/18/2019,213173,52,greg.miller,2020-12-04T20:10:58Z,,0.735,0.688,5,-5.471,1,0.104,0.21,0.0000311,0.106,0.282,110.045,4,2020 Songs,5Hqh5VPCQtJkDEfc8L1EAi
6Flu33CZc4xS2gkA6cRcNh,Texas Sun,Texas Sun,Khruangbin;Leon Bridges,02/07/2020,252811,0,greg.miller,2020-12-04T19:49:51Z,"neo-psychedelic,retro soul",0.635,0.631,7,-10.007,1,0.0343,0.0378,0.138,0.0997,0.619,111.563,4,2020 Songs,5Hqh5VPCQtJkDEfc8L1EAi
6rAHOCqNXqWViRexgcWKVZ,24-7,KIN,Electric Guest,10/17/2019,208933,31,greg.miller,2020-12-04T19:49:27Z,,0.729,0.597,11,-5.852,1,0.0457,0.219,0.000231,0.142,0.931,95.011,4,2020 Songs,5Hqh5VPCQtJkDEfc8L1EAi
6RZmhpvukfyeSURhf4kZ0d,Is It True,The Slow Rush,Tame Impala,02/14/2020,239266,76,greg.miller,2020-12-04T19:48:57Z,"neo-psychedelic,indie",0.731,0.664,0,-5.474,1,0.0302,0.00307,0.35,0.133,0.661,118.018,4,2020 Songs,5Hqh5VPCQtJkDEfc8L1EAi
6vaSStNN5NX4nJ4QbRY3S0,Colors,Black Pumas,Black Pumas,06/21/2019,246586,0,greg.miller,2020-12-04T19:54:51Z,retro soul,0.391,0.692,1,-6.543,0,0.0462,0.0946,0.0000158,0.191,0.56,180.029,4,2020 Songs,5Hqh5VPCQtJkDEfc8L1EAi
6veAJAYXhNWDKMAZLDfCrz,The World And I,Mystic Truth,Bad Suns,03/22/2019,172133,27,greg.miller,2020-12-16T01:54:29Z,,0.404,0.854,11,-3.755,1,0.0458,0.000125,0.174,0.0598,0.572,154.354,4,2020 Songs,5Hqh5VPCQtJkDEfc8L1EAi
6WmIyn2fx1PKQ0XDpYj4VR,Love It If We Made It,A Brief Inquiry Into Online Relationships,The 1975,11/30/2018,252925,66,greg.miller,2020-12-04T19:49:29Z,,0.472,0.745,4,-5.297,1,0.0357,0.000607,0.0000274,0.0957,0.063,180.06,4,2020 Songs,5Hqh5VPCQtJkDEfc8L1EAi
6xZ4Q2k2ompmDppyeESIY8,Level of Concern,Level of Concern,Twenty One Pilots,04/09/2020,220051,62,greg.miller,2020-12-14T19:32:23Z,,0.754,0.583,4,-7.34,0,0.0432,0.32,0.00015,0.144,0.77,122.012,4,2020 Songs,5Hqh5VPCQtJkDEfc8L1EAi
7egu63DOhNpivWOpGtzqGS,Lamb's Wool,Lamb's Wool,Foster The People,05/22/2020,276360,57,greg.miller,2020-12-04T19:49:49Z,,0.433,0.614,8,-7.594,0,0.0499,0.111,0.0000561,0.141,0.233,178.751,4,2020 Songs,5Hqh5VPCQtJkDEfc8L1EAi
07C3oEuCStuueA9cBYLRuL,Wake Me up to Drive,Dragon New Warm Mountain I Believe In You,Big Thief,02/11/2022,223601,47,frank.gibase,2022-02-11T19:12:34Z,"art pop,brooklyn indie,indie pop,indie rock,small room",0.683,0.654,7,-11.64,1,0.0524,0.663,0.00803,0.116,0.682,131.263,4,2022 FG,0DEkbJPeIju1tdbszBVubR
0dtockARXN0d8JoMGUuCIF,Is It Supposed,Cry Sugar,Hudson Mohawke,08/12/2022,374066,38,frank.gibase,2022-08-12T17:12:14Z,"electronica,purple sound,scottish electronic,scottish hip hop,uk bass,uk experimental electronic,wonky",0.625,0.696,4,-6.216,1,0.0488,0.212,0.814,0.104,0.496,132.047,4,2022 FG,0DEkbJPeIju1tdbszBVubR
0vu3XfUitueA4S7l93kNU3,Oxygen,Oxygen,Beach Bunny,10/27/2021,186146,48,frank.gibase,2022-03-25T18:33:40Z,"bubblegrunge,chicago indie,indie pop,indie rock",0.42,0.943,6,-5.436,1,0.0808,0.00105,0,0.276,0.484,163.946,4,2022 FG,0DEkbJPeIju1tdbszBVubR
1FjITBDWT1DyZGiMaJvy2a,Edge of the Edge,Edge of the Edge,"Panda Bear,Sonic Boom",08/03/2022,288746,42,frank.gibase,2022-08-09T22:46:26Z,"alternative dance,alternative rock,art pop,chamber pop,chamber psych,chillwave,collage pop,dream pop,electronica,experimental pop,garage psych,indie rock,neo-psychedelic,new rave,noise pop,british experimental",0.577,0.806,7,-5.134,1,0.0406,0.272,0.000022,0.0795,0.707,128.377,4,2022 FG,0DEkbJPeIju1tdbszBVubR
1gaByCFB1qArGJUIvgmolV,Call You,Call You,DJ Sabrina The Teenage DJ,04/20/2022,515409,14,frank.gibase,2022-05-05T13:00:47Z,,0.575,0.796,6,-7.397,1,0.141,0.184,0,0.261,0.538,122.035,4,2022 FG,0DEkbJPeIju1tdbszBVubR
1MpCaOeUWhox2Fgigbe1cL,I'M THAT GIRL,RENAISSANCE,Beyoncé,07/29/2022,208014,74,frank.gibase,2022-07-29T14:27:56Z,"dance pop,pop,r&b",0.554,0.535,5,-8.959,0,0.186,0.0616,0.0000132,0.124,0.136,105.865,4,2022 FG,0DEkbJPeIju1tdbszBVubR
2eQ9B2SsQFU2qCnHSas3eQ,Sunset,Sunset,Caroline Polachek,10/17/2022,163116,65,frank.gibase,2022-11-01T12:55:11Z,"art pop,dance pop,electropop,escape room,indie pop,indietronica,pop",0.462,0.745,11,-5.356,0,0.0652,0.589,0.00015,0.288,0.648,122.051,4,2022 FG,0DEkbJPeIju1tdbszBVubR
2ownDSIYHvydbtauGZW4ln,You Will Never Work In Television Again,A Light for Attracting Attention,The Smile,05/13/2022,168172,57,frank.gibase,2022-06-15T15:44:20Z,indie rock,0.338,0.828,0,-6.377,1,0.1,0.00198,0.023,0.0996,0.198,176.842,5,2022 FG,0DEkbJPeIju1tdbszBVubR
2P0LyX02PXKXKMPOH7Zff7,Year of Love,Year of Love,Jenny Hval,01/18/2022,253212,31,frank.gibase,2022-01-18T16:21:33Z,"art pop,chamber psych,electra,experimental pop,norwegian experimental,spectra",0.668,0.54,7,-9.228,0,0.031,0.301,0.0207,0.129,0.598,92.027,4,2022 FG,0DEkbJPeIju1tdbszBVubR
346SJSEbB6pNZMpwovxDiu,Mother I Sober (feat. Beth Gibbons of Portishead),Mr. Morale & The Big Steppers,"Kendrick Lamar,Beth Gibbons",05/13/2022,406528,64,frank.gibase,2022-06-15T15:44:36Z,"conscious hip hop,hip hop,rap,west coast rap,art pop,devon indie,electronica,solo wave,trip hop",0.492,0.369,8,-14.861,0,0.329,0.87,0.0000285,0.11,0.491,140.012,4,2022 FG,0DEkbJPeIju1tdbszBVubR
35lxFAny9XDBkvE6r9j4uG,Happiness,Being Funny In A Foreign Language,The 1975,10/14/2022,303903,72,frank.gibase,2022-12-13T18:37:54Z,"modern alternative rock,modern rock,pop,rock",0.662,0.905,11,-5.036,1,0.0383,0.0529,0.0521,0.202,0.857,117.997,4,2022 FG,0DEkbJPeIju1tdbszBVubR
374EKgkkuCrw0ovQPYn1vT,Western Wind,The Loneliest Time,Carly Rae Jepsen,10/21/2022,225946,60,frank.gibase,2022-12-08T15:40:13Z,"canadian pop,dance pop,electropop,pop,post-teen pop",0.633,0.808,9,-6.789,1,0.142,0.23,0.00027,0.0953,0.548,89.728,4,2022 FG,0DEkbJPeIju1tdbszBVubR
3gUMS1fDjBeOTt9WuQPpkQ,This Is A Photograph,Rock Bottom,Kevin Morby,03/30/2022,210333,0,frank.gibase,2022-03-30T22:20:40Z,"indie rock,kc indie,modern folk rock",0.722,0.914,4,-4.954,0,0.0492,0.51,0.00129,0.119,0.779,123.992,4,2022 FG,0DEkbJPeIju1tdbszBVubR
3KyKxJ4P3pVCgaZwaq2rUC,Gasoline,Dawn FM,The Weeknd,01/06/2022,212165,73,frank.gibase,2022-01-18T16:21:51Z,"canadian contemporary r&b,canadian pop,pop",0.728,0.741,6,-7.075,0,0.0473,0.000582,0.00206,0.33,0.31,123.006,4,2022 FG,0DEkbJPeIju1tdbszBVubR
4f1KkbXHnfIVZ9vmIExByJ,That's Where I Am,That's Where I Am,Maggie Rogers,04/08/2022,252760,44,frank.gibase,2022-06-15T15:43:44Z,"indie pop,pop",0.269,0.764,7,-3.735,1,0.0534,0.132,0,0.0723,0.15,181.299,4,2022 FG,0DEkbJPeIju1tdbszBVubR
4FHJqPdhIHhHn1JfcdwQOL,On The Ground,Janky Star,Grace Ives,06/10/2022,205386,45,frank.gibase,2022-06-10T15:31:17Z,"alternative r&b,art pop,escape room,experimental indie,indie pop",0.834,0.928,2,-3.183,1,0.0346,0.00813,0.411,0.0795,0.795,132.993,4,2022 FG,0DEkbJPeIju1tdbszBVubR
4l80EAKjqQ9y68eclkXHSj,Strung with Everything,Time Skiffs,Animal Collective,02/04/2022,416117,35,frank.gibase,2022-02-04T15:46:48Z,"alternative rock,art pop,baltimore indie,dream pop,experimental pop,freak folk,indie rock,modern rock,new rave,noise pop",0.547,0.691,0,-8.332,1,0.0387,0.0631,0.000165,0.166,0.212,111.018,4,2022 FG,0DEkbJPeIju1tdbszBVubR
4MV86lthrqvU7Q8jj7NaP5,Spiderweb,Spiderweb,Built To Spill,07/26/2022,323300,13,frank.gibase,2022-08-03T21:34:34Z,"alternative pop,alternative rock,anti-folk,idaho indie,indie rock,lo-fi,modern rock",0.233,0.818,2,-8.399,1,0.0466,0.00949,0.00457,0.114,0.654,139.652,4,2022 FG,0DEkbJPeIju1tdbszBVubR
4UKQcBQ4JFZgsTkRMQzHT4,Soul to Blessed Soul,Soul to Blessed Soul,Swamp Dogg,01/06/2022,335853,35,frank.gibase,2022-01-14T16:51:22Z,"funk,soul,southern soul",0.558,0.534,3,-9.808,1,0.0295,0.337,0.00192,0.114,0.645,140.195,4,2022 FG,0DEkbJPeIju1tdbszBVubR
5PmvRPR1SedsWA08jDDgF9,Runner,Runner,Alex G,06/21/2022,156772,51,frank.gibase,2022-06-21T19:07:54Z,"indie pop,philly indie",0.732,0.703,11,-7.224,1,0.0314,0.104,0.0417,0.109,0.836,108.979,4,2022 FG,0DEkbJPeIju1tdbszBVubR
61ctGxwAyEQH9P2mXi3TcV,California Saga (Big Sur),Sail On Sailor – 1972 (Deluxe),The Beach Boys,12/02/2022,175800,18,frank.gibase,2022-12-08T15:31:24Z,"baroque pop,classic rock,psychedelic rock,rock,sunshine pop",0.517,0.396,11,-13.488,1,0.0337,0.00576,0.443,0.113,0.226,146.578,3,2022 FG,0DEkbJPeIju1tdbszBVubR
65vtwc4JSGhKZJTV0Nhs3W,Through It All,Piece of Me,Lady Wray,01/28/2022,204747,48,frank.gibase,2022-06-28T15:46:10Z,"alternative r&b,funk,indie soul,neo soul,soul",0.663,0.903,5,-6.089,0,0.0511,0.00429,0.254,0.066,0.947,161.373,4,2022 FG,0DEkbJPeIju1tdbszBVubR
66fCNfMdIKsXOnSphorrwg,jealousy (feat. rema),CAPRISONGS,"FKA twigs,Rema",01/14/2022,159666,59,frank.gibase,2022-01-14T16:51:02Z,"afrofuturism,alternative r&b,art pop,escape room,experimental r&b,pop,trip hop,nigerian pop",0.828,0.638,1,-5.346,0,0.0767,0.285,0.0000727,0.133,0.525,113.486,5,2022 FG,0DEkbJPeIju1tdbszBVubR
67pM77WfVW5S5SWF8V6bvu,The Sound Of This Place - Ypsigrock Festival 2021,The Sound Of This Place (Ypsigrock Festival 2021),"Camilla Sparksss,Clap Your Hands Say Yeah,Eva Geist",07/26/2022,482961,33,frank.gibase,2022-07-28T20:51:00Z,"canadian experimental,alternative dance,alternative rock,brooklyn indie,chamber pop,indie pop,indie rock,modern rock,new rave,philly indie,stomp and holler",0.468,0.489,7,-12.953,1,0.0488,0.525,0.858,0.134,0.256,133.319,4,2022 FG,0DEkbJPeIju1tdbszBVubR
6grxumO02W0QOAQSXOfniS,Tom Verlaine,Blue Rev,Alvvays,10/07/2022,206335,45,frank.gibase,2022-10-13T22:00:01Z,"dreamo,indie pop,indie rock,shoegaze,toronto indie",0.321,0.939,4,-4.115,1,0.116,0.0214,0.00122,0.0903,0.146,138.947,4,2022 FG,0DEkbJPeIju1tdbszBVubR
6PsqixVNSE6N4WamoMFISK,Alaska,11:11,Pinegrove,01/28/2022,125830,49,frank.gibase,2022-12-08T15:41:55Z,"alternative emo,emo,indie pop,indie rock,new jersey indie,small room",0.498,0.702,8,-6.741,1,0.0273,0.00744,0.0000717,0.112,0.404,104.969,4,2022 FG,0DEkbJPeIju1tdbszBVubR
6XeNfVpkrE1Ai9CQWo4cgu,LET’S DO IT AGAIN,LET’S DO IT AGAIN,Jamie xx,04/12/2022,439441,50,frank.gibase,2022-04-15T15:51:06Z,"electronica,future garage,new rave",0.683,0.757,2,-8.808,0,0.0354,0.07,0.874,0.112,0.31,124.003,4,2022 FG,0DEkbJPeIju1tdbszBVubR
74loibzxXRL875X20kenvk,Poland,Poland,Lil Yachty,10/11/2022,83200,83,frank.gibase,2022-10-11T19:42:46Z,"atl hip hop,hip hop,melodic rap,rap,trap,underground hip hop,viral rap",0.695,0.555,5,-8.5,0,0.0509,0.141,0.826,0.11,0.26,150.024,4,2022 FG,0DEkbJPeIju1tdbszBVubR
7dYjEwbLJ1B5reoz3lWra0,Nova,Nova / Moth,"Burial,Four Tet",02/11/2022,342000,54,frank.gibase,2022-03-07T16:11:12Z,"classic dubstep,electronica,hauntology,intelligent dance music,microhouse,uk bass,wonky,folktronica",0.675,0.759,6,-13.982,0,0.0543,0.516,0.934,0.372,0.129,127.991,4,2022 FG,0DEkbJPeIju1tdbszBVubR
7eJvbMU5XPEg2e8YHMdt9r,Concorde,Snow Globes,"Black Country, New Road",01/19/2022,363773,18,frank.gibase,2022-01-21T19:48:35Z,"indie rock,london indie,modern rock,uk post-punk revival",0.564,0.284,9,-11.888,1,0.0294,0.023,0.0843,0.113,0.316,129.611,3,2022 FG,0DEkbJPeIju1tdbszBVubR
05uhED0miR9OJYPalPi7tx,Wild,Lucifer On The Sofa,Spoon,02/11/2022,193277,61,greg.miller,2022-12-14T16:28:28Z,"alternative rock,austindie,indie rock,modern rock,pop rock,rock",0.647,0.701,4,-8.043,1,0.0375,0.0394,0.000142,0.0765,0.813,97.003,4,2022 Songs,2ifUqeNg1hjXApQ1cemGQB
0axBrs6n3iKi3LAIISrcDh,Fora,Fora,Southern Shores,04/07/2021,231587,46,greg.miller,2022-12-14T16:43:58Z,"chillwave,indie dream pop",0.667,0.668,3,-6.836,1,0.0563,0.00631,0.91,0.122,0.685,113.995,4,2022 Songs,2ifUqeNg1hjXApQ1cemGQB
0JRsF8dhA1REeU30rW9mKL,Deadlines,Deadlines,Surprise Chef,09/18/2020,270085,31,greg.miller,2022-12-14T16:58:53Z,"indie jazz,indie soul,neo-psychedelic,uk contemporary jazz",0.381,0.862,0,-5.297,1,0.0685,0.0337,0.227,0.192,0.413,169.802,4,2022 Songs,2ifUqeNg1hjXApQ1cemGQB
0rzaRSujxA0bKyjJl6vHYq,Satellite,Harry's House,Harry Styles,05/20/2022,218577,83,greg.miller,2022-12-14T16:17:45Z,pop,0.576,0.457,0,-6.473,1,0.0304,0.143,0.0000305,0.0917,0.301,138.984,4,2022 Songs,2ifUqeNg1hjXApQ1cemGQB
1JNv9ICYbayNgqm8fKPLqP,Go Away,Ivory,Omar Apollo,04/08/2022,207346,61,greg.miller,2022-12-14T15:53:36Z,"bedroom pop,bedroom soul,pop",0.634,0.568,5,-7.757,0,0.0354,0.0426,0.00000185,0.456,0.369,123.885,4,2022 Songs,2ifUqeNg1hjXApQ1cemGQB
1wAG3iT5zxaR0AHcFyBp2J,Life Was Easier When I Only Cared About Me,Apocalypse Whenever (Deluxe Edition),Bad Suns,09/30/2022,231125,33,greg.miller,2022-12-14T16:00:20Z,"indie poptimism,la indie,modern alternative rock,modern rock",0.626,0.912,1,-4.786,1,0.0355,0.00649,0.00652,0.137,0.748,139.978,4,2022 Songs,2ifUqeNg1hjXApQ1cemGQB
2F9DCIJ7ZXHhNkiIlIIOkw,All I Ever Asked,All I Ever Asked,Rachel Chinouriri,03/08/2022,215384,62,greg.miller,2022-12-14T16:08:45Z,uk pop,0.913,0.459,5,-7.528,1,0.0446,0.469,0.000889,0.0891,0.848,114.996,4,2022 Songs,2ifUqeNg1hjXApQ1cemGQB
2KZVQQfBRgAYkFqlr3GRqv,Funky,Where Have All the Flowers Gone?,Deb Never,09/10/2021,214760,42,greg.miller,2022-12-14T16:43:14Z,"indie pop,modern indie pop",0.557,0.703,1,-7.024,0,0.0584,0.0791,0,0.27,0.492,166.964,4,2022 Songs,2ifUqeNg1hjXApQ1cemGQB
2QHE1sL1IvYU5TLyAcN6pR,Call It Off,Call It Off,"Skinnydip,Claire Brooks",04/05/2018,228196,44,greg.miller,2022-12-14T16:21:12Z,,0.729,0.336,6,-9.939,0,0.0389,0.146,0.088,0.678,0.374,122.001,4,2022 Songs,2ifUqeNg1hjXApQ1cemGQB
2tEfW1QMddoTWIIgHtHiPV,all my ghosts,five seconds flat,Lizzy McAlpine,04/08/2022,197032,42,greg.miller,2022-12-14T16:25:50Z,"boston folk,indie pop,pop",0.64,0.292,3,-11.706,1,0.0468,0.336,0.000628,0.436,0.491,155.074,4,2022 Songs,2ifUqeNg1hjXApQ1cemGQB
35TyJIMR3xRouUuo2sjS6v,Cinema,Harry's House,Harry Styles,05/20/2022,243507,79,greg.miller,2022-12-14T16:02:48Z,pop,0.829,0.644,9,-7.696,0,0.0427,0.354,0.0511,0.0944,0.896,105.993,4,2022 Songs,2ifUqeNg1hjXApQ1cemGQB
